"Issue Name","Issue Type","Issue Priority","URLs","% of Total","Description","How To Fix","Help URL"
"Links: Pages With High Crawl Depth","Opportunity","Medium","310","51.160","Pages that have a high crawl depth from the start page of the crawl based upon the 'Crawl Depth' preferences under 'Config > Spider > Preferences'. Broadly, pages that are linked directly from popular pages, such as the homepage, are passed more PageRank which can help them perform better organically. Pages much deeper in the website can often be passed less PageRank, and subsequently may not perform as well. This is important for key pages that are targeting broader more competitive queries, which may benefit from improved linking and reduced crawl depth. Unimportant pages, pages that target less competitive queries, or pages on large websites will often naturally sit deeper without issue. Most importantly, consider the user, which pages are important for them to navigate to, and their journey to reach the page.","Review pages that are deeper in the website with a high crawl depth. Improve website structure and internal linking to key pages that may benefit where appropriate.",""
"Response Codes: Internal Blocked by Robots.txt","Warning","High","1","0.040","Internal URLs blocked by the site's robots.txt. This means they cannot be crawled and is a critical issue if you want the page content to be crawled and indexed by search engines. View URLs that link to URLs blocked by robots.txt using the lower 'inlinks' tab and export them in bulk via 'Bulk Export > Response Codes > Internal > Blocked by Robots.txt inlinks'.","Review URLs to ensure they should be disallowed. If they are incorrectly disallowed, then the site's robots.txt should be updated to allow them to be crawled. Consider whether you should be linking internally to these URLs and remove links where appropriate.",""
"Security: Missing X-Frame-Options Header","Warning","Low","666","94.470","URLs missing an X-Frame-Options response header with a 'DENY' or 'SAMEORIGIN' value. This instructs the browser not to render a page within a frame, iframe, embed or object. This helps avoid 'clickjacking' attacks, where your content is displayed on another web page that is controlled by an attacker.","To minimise security issues, the X-Frame-Options response header should be supplied with a 'DENY' or 'SAMEORIGIN' value.",""
"Links: Follow & Nofollow Internal Inlinks To Page","Warning","Low","1","0.170","Pages that have both rel=""nofollow"" and follow links to them from other pages. Links marked with nofollow link attributes will generally not be followed by search engines. Links without a nofollow link attribute will generally be followed. So inconsistent use of links that are follow and nofollow might be a sign of an issue or mistake, or something that can be ignored. Nofollow and follow inlinks can be seen in the 'Inlinks' tab with the 'All Link Types' filter set to 'Hyperlinks', where the 'Follow' column is 'True' and 'False'. Export in bulk via 'Bulk Export > Links > Follow & Nofollow Internal Inlinks To Page'.","Review the consistency of the use of rel=""nofollow"" on internal links. These might be valid to URLs that ideally wouldn't be crawled, or they could be by mistake. Remove the nofollow link attribute to important URLs you wish to be crawled, indexed and receive PageRank. Add nofollow to any links that are incorrectly missing it.",""
"Sitemaps: URLs not in Sitemap","Issue","Medium","10","1.550","URLs that are not in an XML Sitemap, but were discovered in the crawl. This might be on purpose (as they are not important), or they might be missing, and the XML Sitemap needs to be updated to include them. This filter does not consider non-indexable URLs, it assumes they are correctly non-indexable, and therefore shouldn't be flagged to be included.","Consider including important canonical URLs within the XML Sitemap. This does not make up for good site architecture and internal linking, but it can aid discovery for large websites, inform Google when the page was last updated, and aid with monitoring indexing of pages.",""
"H2: Duplicate","Opportunity","Low","111","18.320","Pages which have duplicate <h2>s. It's important to have distinct, unique and useful pages. If every page has the same <h2>, then it can make it more challenging for users and the search engines to understand one page from another.","Update duplicate <h2>s as necessary, so important pages contain a unique and descriptive <h2> for users and search engines.  If these are duplicate pages, then fix the duplicated pages by linking to a single version, and redirect or use canonicals where appropriate.",""
"Search Console: No Search Analytics Data","Warning","Low","580","89.920","URLs that are not returning impressions in the performance report in Google Search Console. URLs either didn't receive any impressions, or perhaps the URLs in the crawl are just different to those in the GSC profile selected.","Review URLs with no search analytics data and consider whether this is expected, or if they could be improved. Please select the correct property in GSC for accurate data.",""
"Content: Readability Difficult","Opportunity","Low","81","13.370","Copy on the page is difficult to read and best understood by college graduates according to the Flesch reading-ease score formula. Copy that has long sentences and uses complex words are generally harder to read and understand.","Consider improving the readability of copy for your target audience. Copy that uses shorter sentences with less complex words is often easier to read and understand.",""
"H2: Non-Sequential","Warning","Low","60","9.900","Pages with an <h2> that is not the second heading level after the <h1> on the page. Heading elements should be in a logical sequentially-descending order. The purpose of heading elements is to convey the structure of the page and they should be in logical order from <h1> to <h6>, which helps navigating the page and users that rely on assistive technologies.","Ensure the <h2> is the second heading on the page. Headings should be in a logical sequential order from <h1> to <h6>. Review and update page heading levels so they are descending in order, for example the heading element following an <h1> should be an <h2>, rather than an <h3>.",""
"URL: Underscores","Opportunity","Low","2","0.280","URLs with underscores, which are not always seen as word separators by search engines.","Ideally hyphens should be used as word separators, rather than underscores. However, changing URLs is a big decision, and often it's not worth changing them for SEO purposes alone. If URLs are changed, then appropriate 301 redirects must be implemented.",""
"Response Codes: External No Response","Warning","Low","10","0.420","External URLs with no response returned from the server. Usually due to a malformed URL, connection timeout, connection error, or connection refused. View URLs that link to no responses using the lower 'inlinks' tab and export them in bulk via 'Bulk Export > Response Codes > External > No Response inlinks'.","Malformed URLs should be updated to the correct location and other connection issues can often be resolved by using different user-agents ('Config > User-Agent'), adjusting the crawl speed ('Config > Speed') or disabling firewalls & proxies. If they can be viewed in a browser, then it's often not an issue.",""
"Images: Missing Alt Attribute","Issue","Low","44","3.360","Images that are missing an alt attribute all together. Click the address (URL) of the image and then the 'Image Details' tab in the lower window pane to view which pages have the image on, and are missing alt attributes. All images should contain an alt attribute with descriptive text, or blank when it's a decorative image.","Include alt attributes with descriptive alt text for images to help users and the search engines understand them better. Where possible, decorative images should be provided using CSS background images or alternatively a null (empty) alt text should be provided (alt="""") so that they can be ignored by assistive technologies, such as screen readers.",""
"Images: Missing Size Attributes","Opportunity","Low","1057","80.750","Image elements without dimensions (width and height size attributes) specified in the HTML. This can cause large layout shifts as the page loads and be frustrating experience for users. It is one of the major reasons that contributes to a high Cumulative Layout Shift (CLS).","Define all image sizes as their native size using width and height attributes in the HTML. This allows the browser to calculate enough space for each image before it loads, avoiding large layout shifts.",""
"H1: Duplicate","Opportunity","Low","108","17.820","Pages which have duplicate <h1>s. It's important to have distinct, unique and useful main headings. If every page has the same <h1>, then it can make it more challenging for users and the search engines to understand one page from another.","Update duplicate <h1>s as necessary, so important pages contain a unique and descriptive <h1> for users and search engines.  If these are duplicate pages, then fix the duplicated pages by linking to a single version, and redirect or use canonicals where appropriate.",""
"URL: Uppercase","Warning","Low","594","84.260","URLs that have uppercase characters within them. URLs are case sensitive, so as best practice generally URLs should be lowercase, to avoid any potential mix ups and duplicate URLs.","Ideally lowercase characters should be used for URLs only. However, changing URLs is a big decision, and often it's not worth changing them for SEO purposes alone. If URLs are changed, then appropriate 301 redirects must be implemented.",""
"Content: Low Content Pages","Opportunity","Medium","141","23.270","Pages with a word count that is below the default 200 words. The word count is based upon the content area settings used in the analysis which can be configured via 'Config > Content > Area'. There isn't a minimum word count for pages in reality, but the search engines do require descriptive text to understand the purpose of a page. This filter should only be used as a rough guide to help identify pages that might be improved by adding more descriptive content in the context of the website and page's purpose. Some websites, such as ecommerce, will naturally have lower word counts, which can be acceptable if a products details can be communicated efficiently.","Consider including additional descriptive content to help the user and search engines better understand the page.",""
"Links: Pages With High External Outlinks","Warning","Low","193","31.850","Pages that have a high number of followed external outlinks on them based upon the 'High External Outlinks' preferences under 'Config > Spider > Preferences'. External outlinks are hyperlinks to another subdomain or domain (depending on your configuration). This might be completely valid, such as linking to another part of the same root domain, or linking to other useful websites. External followed outlinks can be seen in the 'Outlinks' tab, with the 'All Link Types' filter set to 'Hyperlinks' where the 'Follow' column is 'True'.","Review followed external outlinks to ensure they are to credible, trusted and relevant websites that are useful to your users.",""
"Sitemaps: Orphan URLs","Issue","Medium","81","12.520","URLs that are only in an XML Sitemap, but were not discovered during the crawl. Or, URLs that are only discovered from URLs in the XML Sitemap, but were not found in the crawl. These might be accidentally included in the XML Sitemap, or they might be pages that you wish to be indexed, and should really be linked to internally.","Review orphan URLs and link to them internally from the website if they should rank in the search results. Remove any pages from the XML Sitemap that should not be indexed and use appropriate directives such as 'noindex'.",""
"Images: Missing Alt Text","Issue","Low","21","1.600","Images that have an alt attribute, but are missing alt text. Click the address of the image and then the 'Image Details' tab in the lower window pane to view which pages have the image on them, and are missing alt text. Images should have descriptive alternative text about its purpose, which helps the blind and visually impaired, and the search engines understand it and its relevance to the web page.","Include descriptive alt text for images to help users and the search engines understand them better. Where possible, decorative images should be provided using CSS background images or alternatively a null (empty) alt text should be provided (alt="""") so that they can be ignored by assistive technologies, such as screen readers.",""
"Images: Alt Text Over 100 Characters","Opportunity","Low","11","0.840","Images which have one instance of alt text over a threshold of characters in length. This is not strictly an issue, however image alt text should be concise and descriptive. It should not be used to stuff lots of keywords or paragraphs of text onto a page.","Write concise alt text that's helpful for users and search engines - without keyword stuffing.",""
"URL: Parameters","Warning","Low","4","0.570","URLs that include parameters such as '?' or '&'. This isn't an issue for Google or other search engines to crawl unless at significant scale, but it's recommended to limit the number of parameters in a URL which can be complicated for users, and can be a sign of low value-add URLs.","Where possible use a static URL structure without parameters for key indexable URLs. However, changing URLs is a big decision, and often it's not worth changing them for SEO purposes alone. If URLs are changed, then appropriate 301 redirects must be implemented.",""
"Structured Data: Rich Result Validation Errors","Issue","High","81","13.370","URLs that contain Google rich result feature validation errors. Google rich result feature validation will show errors for missing required properties or problems with the implementation of required properties. Google's 'required properties' must be included and be valid for content to be eligible for display as a rich result.","Resolve validation errors to ensure pages are eligible for special search result features in Google. Review the 'Structured Data Details' tab for more information on specific errors and refer to Google rich result feature docs where necessary. Export unique validation errors using 'Reports > Structured Data > Validation Errors & Warnings Summary' and test in Google's Rich Results tool.",""
"H1: Missing","Issue","Medium","42","6.930","Pages which have a missing <h1>, the content is empty or has a whitespace. The <h1> should describe the main title and purpose of the page and are considered to be one of the stronger on-page ranking signals.","Ensure important pages have concise, descriptive and unique headings to help users, and enable search engines to score and rank the page for relevant search queries.",""
"Page Titles: Over 561 Pixels","Opportunity","Medium","43","7.100","Pages which have page titles over Google's estimated pixel length limit for titles in search results. Google snippet length is actually based upon pixels limits, rather than a character length. The SEO Spider tries to match the latest pixel truncation points in the SERPs, but it is an approximation and Google adjusts them frequently.","Write concise page titles to ensure important words are not truncated in the search results, not visible to users and potentially weighted less in scoring.",""
"Page Titles: Duplicate","Opportunity","Medium","131","21.620","Pages which have duplicate page titles. It's really important to have distinct and unique page titles for every page. If every page has the same page title, then it can make it more challenging for users and the search engines to understand one page from another.","Update duplicate page titles as necessary, so each page contains a unique and descriptive title for users and search engines. If these are duplicate pages, then fix the duplicated pages by linking to a single version, and redirect or use canonicals where appropriate.",""
