2026-04-27,https://almapay.com/it-IT/blog/azioni-di-fidelizzazione,text/html; charset=utf-8,200,OK,Indexable,,Azioni di fidelizzazione: 9 esempi per il tuo business,54,463,Le azioni di fidelizzazione fanno tornare i clienti e aumentano le vendite. Scopri 9 esempi pratici da applicare subito al tuo business.,136,803,,0,9 modi per fidelizzare i clienti,32,Cosa sono le azioni di fidelizzazione?,38,Quali sono gli obiettivi delle azioni di fidelizzazione?,56,,,,https://almapay.com/it-IT/blog/azioni-di-fidelizzazione,,,,,,187879,50234,50234,19.244,,1649,228,7.232,21.983,Very Hard,6.355,4,2,1,8,3,0,0.510,56,29,0,10,8,0,,,,,a74c8c88880325d73ae40251bcf37b4,0.394,,,,,it-IT,1.1,,,,,,,,,,,,,,,,,,,,,,,,,,,,,,,,,,,,,,,,,,,,,,,,,,,,,,,,,,,,,,,,,,,,,,,,,,,,,,,,,,,,,,,,,,,,,,,,,https://almapay.com/it-IT/blog/azioni-di-fidelizzazione,2026-04-27 15:45:44
2026-04-27,https://almapay.com/fr-FR/blog/tunnel-de-conversion-ecommerce,text/html; charset=utf-8,200,OK,Indexable,,Tunnel de conversion e-commerce : optimiser les achats,54,504,Le tunnel d’achat (ou de conversion) désigne l’ensemble des étapes pour amener le client vers l’achat. Comment l’améliorer ? On vous explique.,142,876,,0,Tunnel de conversion e-commerce : définition et conseils d’optimisation,71,Qu’est-ce que le tunnel de conversion e-commerce ?,50,Mieux comprendre chacune des étapes du tunnel de conversion e-commerce,70,,,,https://almapay.com/fr-FR/blog/tunnel-de-conversion-ecommerce,,,,,,250320,63853,63853,24.461,,2139,308,6.945,64.996,Normal,6.382,4,2,1,18,10,0,1.680,88,57,0,11,10,0,,,,,ef98739f91bd92debf03a46fe3c226f8,0.400,,,,,fr-FR,1.1,,,,,,,,,,,,,,,,,,,,,,,,,,,,,,,,,,,,,,,,,,,,,,,,,,,,,,,,,,,,,,,,,,,,,,,,,,,,,,,,,,,,,,,,,,,,,,,,,https://almapay.com/fr-FR/blog/tunnel-de-conversion-ecommerce,2026-04-27 15:45:44
2026-04-27,https://almapay.com/fr-FR/blog/meilleur-terminal-de-paiement-tpe,text/html; charset=utf-8,200,OK,Indexable,,Meilleur TPE en 2024 : top 9 des terminaux de paiement,54,499,Un terminal de paiement permet d’opérer des transactions avec une carte bancaire en lecture. Comment choisir le meilleur ? A quel prix ? On vous explique.,154,946,,0,Les 9 meilleurs terminaux de paiement (TPE) en 2025,51,Qu’est-ce qu’un terminal de paiement,36,Quels sont les critères pour choisir un TPE ?,45,,,,https://almapay.com/fr-FR/blog/meilleur-terminal-de-paiement-tpe,,,,,,236320,59499,59499,22.793,,2022,280,7.221,71.643,Fairly Easy,6.257,4,2,1,8,4,0,0.670,78,50,0,9,8,0,,,,,4776f8968838ec5cf236199ae99b19d6,0.404,,,,,fr-FR,1.1,,,,,,,,,,,,,,,,,,,,,,,,,,,,,,,,,,,,,,,,,,,,,,,,,,,,,,,,,,,,,,,,,,,,,,,,,,,,,,,,,,,,,,,,,,,,,,,,,https://almapay.com/fr-FR/blog/meilleur-terminal-de-paiement-tpe,2026-04-27 15:45:44
2026-04-27,https://almapay.com/fr-FR/blog/attirer-clients-ecommerce,text/html; charset=utf-8,200,OK,Indexable,,Attirer des clients sur son site e-commerce : 7 conseils,56,488,La rentabilité d’une boutique en ligne dépend du nombre de visiteurs par mois. Comment générer du trafic et des clients ? On vous explique comment !,148,918,,0,7 conseils pour attirer des clients et générer du trafic vers votre e-commerce,78,L’acquisition de client : un enjeu pour tous les e-commerçant,61,N°1 : Se démarquer de la concurrence,36,,,,https://almapay.com/fr-FR/blog/attirer-clients-ecommerce,,,,,,241323,61045,61045,23.385,,1863,281,6.630,68.733,Normal,5.828,4,2,1,21,9,0,1.520,94,60,0,15,14,0,,,,,1887800951f2098357e1750ad0d6f7b,0.410,,,,,fr-FR,1.1,,,,,,,,,,,,,,,,,,,,,,,,,,,,,,,,,,,,,,,,,,,,,,,,,,,,,,,,,,,,,,,,,,,,,,,,,,,,,,,,,,,,,,,,,,,,,,,,,https://almapay.com/fr-FR/blog/attirer-clients-ecommerce,2026-04-27 15:45:44
2026-04-27,https://almapay.com/fr-FR/blog/parcours-client-en-magasin,text/html; charset=utf-8,200,OK,Indexable,,Parcours client en magasin : définition et optimisation,55,482,"Le parcours en magasin désigne la manière dont un client interagit avec votre boutique : produits consultés, rayons visités, etc. On vous explique.",147,890,,0,Parcours du client en magasin : définition et conseils pour l’améliorer,71,Qu’est-ce que le parcours client en magasin ?,45,Quels sont les axes du parcours client en magasin ?,51,,,,https://almapay.com/fr-FR/blog/parcours-client-en-magasin,,,,,,234280,56752,56752,21.741,,1520,211,7.204,70.007,Fairly Easy,4.968,4,2,1,18,12,0,2.020,81,51,0,9,8,0,,,,,ec109d3f705a3fa6c5ef9bb5b37569e2,0.446,,,,,fr-FR,1.1,,,,,,,,,,,,,,,,,,,,,,,,,,,,,,,,,,,,,,,,,,,,,,,,,,,,,,,,,,,,,,,,,,,,,,,,,,,,,,,,,,,,,,,,,,,,,,,,,https://almapay.com/fr-FR/blog/parcours-client-en-magasin,2026-04-27 15:45:44
2026-04-27,https://almapay.com/fr-FR/blog/comment-ameliorer-panier-moyen,text/html; charset=utf-8,200,OK,Indexable,,11 méthodes pour augmenter le panier moyen de ses clients,57,539,Le panier moyen impacte le chiffre d’affaires. C’est la somme dépensée par un client à chaque achat. Comment améliorer le panier moyen ? On vous explique.,154,965,,0,11 méthodes pour augmenter le panier moyen de ses clients,57,Qu’est-ce que le panier moyen ?,31,Comment améliorer le panier moyen de vos clients ?,50,,,,https://almapay.com/fr-FR/blog/comment-ameliorer-panier-moyen,,,,,,251227,59968,59968,22.973,,1765,244,7.234,69.501,Normal,5.265,4,2,1,28,24,0,4.040,82,52,0,9,8,0,,,,,752fdd6d8362cf0e812165aa0f6a6349,0.395,,,,,fr-FR,1.1,,,,,,,,,,,,,,,,,,,,,,,,,,,,,,,,,,,,,,,,,,,,,,,,,,,,,,,,,,,,,,,,,,,,,,,,,,,,,,,,,,,,,,,,,,,,,,,,,https://almapay.com/fr-FR/blog/comment-ameliorer-panier-moyen,2026-04-27 15:45:44
2026-04-27,https://almapay.com/fr-FR/blog/point-de-vente-connecte,text/html; charset=utf-8,200,OK,Indexable,,Point de vente connecté : le nouveau standard du commerce,57,540,Connaissez-vous le concept de point de vente connecté ? Les commerçants se digitalisent pour mieux vendre. Découvrez son explication et ses avantages.,150,949,,0,Point de vente connecté : le nouveau standard du commerce,57,En quoi consiste un point de vente connecté ?,45,#1 - Proposer un parcours d’achat immersif,42,,,,https://almapay.com/fr-FR/blog/point-de-vente-connecte,,,,,,255178,61829,61829,23.686,,2083,289,7.208,71.177,Fairly Easy,5.926,4,2,1,9,3,0,0.510,89,55,0,11,10,0,,,,,28c99f5c8a190430f5ded1345a323922,0.491,,,,,fr-FR,1.1,,,,,,,,,,,,,,,,,,,,,,,,,,,,,,,,,,,,,,,,,,,,,,,,,,,,,,,,,,,,,,,,,,,,,,,,,,,,,,,,,,,,,,,,,,,,,,,,,https://almapay.com/fr-FR/blog/point-de-vente-connecte,2026-04-27 15:45:44
2026-04-27,https://almapay.com/fr-FR/blog/experience-client-personnalisee,text/html; charset=utf-8,200,OK,Indexable,,Personnalisation de l’expérience client : enjeux et conseils,60,518,Une expérience client personnalisée engage vos clients et améliore vos performances de vente. Comment créer un parcours personnalisé ? On vous explique.,152,960,,0,Expérience client personnalisée : conseils pour engager vos clients,67,En quoi consiste la personnalisation de l’expérience client,59,Quels sont les avantages d’une expérience client personnalisée ?,64,,,,https://almapay.com/fr-FR/blog/experience-client-personnalisee,,,,,,266812,64205,64205,24.596,,2344,342,6.854,67.456,Normal,6.530,4,2,1,18,12,0,2.020,82,54,0,12,11,0,,,,,d48482242552913351debfd9c97b048b,0.417,,,,,fr-FR,1.1,,,,,,,,,,,,,,,,,,,,,,,,,,,,,,,,,,,,,,,,,,,,,,,,,,,,,,,,,,,,,,,,,,,,,,,,,,,,,,,,,,,,,,,,,,,,,,,,,https://almapay.com/fr-FR/blog/experience-client-personnalisee,2026-04-27 15:45:45
2026-04-27,https://almapay.com/fr-FR/blog/page-accueil-ecommerce,text/html; charset=utf-8,200,OK,Indexable,,Page d’accueil e-commerce : comment convertir ? [+ exemples],60,564,"La page d’accueil est le premier point d’entrée du site e-commerce. Son optimisation impacte le SEO, la navigation et les ventes. On vous explique.",147,891,,0,Page d’accueil e-commerce : conseils et exemples pour l’optimiser,65,En quoi la page d’accueil e-commerce est importante ?,53,Quels sont les éléments indispensables de la page d’accueil ?,61,,,,https://almapay.com/fr-FR/blog/page-accueil-ecommerce,,,,,,275185,70796,70796,27.121,,2526,368,6.864,70.423,Fairly Easy,6.483,4,2,1,13,9,0,1.520,80,52,0,11,10,0,,,,,45aad62e5bf8f41336a6569eb5c43836,0.384,,,,,fr-FR,1.1,,,,,,,,,,,,,,,,,,,,,,,,,,,,,,,,,,,,,,,,,,,,,,,,,,,,,,,,,,,,,,,,,,,,,,,,,,,,,,,,,,,,,,,,,,,,,,,,,https://almapay.com/fr-FR/blog/page-accueil-ecommerce,2026-04-27 15:45:45
2026-04-27,https://almapay.com/fr-FR/blog/integrations-e-commerce-alma-du-hack-au-produit,text/html; charset=utf-8,200,OK,Indexable,,"Intégrations e-commerce Alma, du hack au produit | Alma",55,512,Olivier Lance & Arnaud Rolland exposent les différents challenges auxquels a fait face l’équipe intégrations et les learnings qui en résultent.,143,851,,0,"Intégrations e-commerce Alma, du hack au produit",48,,0,,0,,,,https://almapay.com/fr-FR/blog/integrations-e-commerce-alma-du-hack-au-produit,,,,,,197445,47383,47383,18.152,,392,68,5.765,77.969,Fairly Easy,2.210,4,2,1,7,5,0,0.840,77,51,0,9,8,0,,,,,17d8dd7c3b2695769ef1ddfe0fbad08b,0.400,,,,,fr-FR,1.1,,,,,,,,,,,,,,,,,,,,,,,,,,,,,,,,,,,,,,,,,,,,,,,,,,,,,,,,,,,,,,,,,,,,,,,,,,,,,,,,,,,,,,,,,,,,,,,,,https://almapay.com/fr-FR/blog/integrations-e-commerce-alma-du-hack-au-produit,2026-04-27 15:45:45
2026-04-27,https://almapay.com/fr-FR/blog/comment-offrir-une-experience-client-de-qualite-pendant-les-pics-d-activite,text/html; charset=utf-8,200,OK,Indexable,,Comment offrir une expérience client de qualité pendant les pics d’activité ?,77,676,Un accueil chaleureux et fluide n’est pas un détail : c’est souvent ce qui fait la différence entre un client qui achète et un client qui repart.,145,828,,0,Comment offrir une expérience client de qualité pendant les pics d’activité ?,77,Renforcez votre équipe d’accueil,32,Optimisez la circulation et l’aménagement de l’espace,53,,,,https://almapay.com/fr-FR/blog/comment-offrir-une-experience-client-de-qualite-pendant-les-pics-d-activite,,,,,,239658,61608,61608,23.601,,1498,206,7.272,71.255,Fairly Easy,4.835,4,2,1,9,2,0,0.340,80,50,0,12,11,0,,,,,c3051f8bbbaeb1e1a364438f1bae1bbe,0.371,,,,,fr-FR,1.1,,,,,,,,,,,,,,,,,,,,,,,,,,,,,,,,,,,,,,,,,,,,,,,,,,,,,,,,,,,,,,,,,,,,,,,,,,,,,,,,,,,,,,,,,,,,,,,,,https://almapay.com/fr-FR/blog/comment-offrir-une-experience-client-de-qualite-pendant-les-pics-d-activite,2026-04-27 15:45:45
2026-04-27,https://almapay.com/fr-FR/blog/strategie-de-fidelisation,text/html; charset=utf-8,200,OK,Indexable,,9 stratégies de fidélisation : conseils pour les commerçants,60,530,Une stratégie de fidélisation correspond à la préparation et la coordination des actions nécessaire pour fidéliser les clients. Découvrez comment faire !,153,918,,0,9 stratégies de fidélisation accessibles pour les commerçants,61,La fidélisation : quels enjeux pour les commerçants ?,53,#1. Proposez une carte de fidélité à tamponner,46,,,,https://almapay.com/fr-FR/blog/strategie-de-fidelisation,,,,,,253744,67951,67951,26.031,,2254,352,6.403,72.272,Fairly Easy,6.509,4,2,1,23,11,0,1.850,83,49,0,15,14,0,,,,,ac49a080e9325ec7c0b09dc8330fd88,0.430,,,,,fr-FR,1.1,,,,,,,,,,,,,,,,,,,,,,,,,,,,,,,,,,,,,,,,,,,,,,,,,,,,,,,,,,,,,,,,,,,,,,,,,,,,,,,,,,,,,,,,,,,,,,,,,https://almapay.com/fr-FR/blog/strategie-de-fidelisation,2026-04-27 15:45:45
2026-04-27,https://almapay.com/fr-FR/blog/drive-to-store,text/html; charset=utf-8,200,OK,Indexable,,"Drive to store : définition, avantages et 8 exemples | Alma",59,514,Connaissez-vous les stratégies Drive-to-store pour amener les clients vers un point de vente ? Découvrez les avantages et des conseils pour les commerçants.,156,966,,0,"Drive to store : définition, avantages et 8 exemples de stratégies",66,Qu'est-ce que le Drive-to-store ?,33,Quelle est la différence entre le Drive to store et le Web to store ?,69,,,,https://almapay.com/fr-FR/blog/drive-to-store,,,,,,302663,73401,73401,28.119,,3306,441,7.497,65.391,Normal,7.614,4,2,1,11,5,0,0.840,87,56,0,17,16,0,,,,,43d7555652a306739608da4b0916fd7,0.383,,,,,fr-FR,1.1,,,,,,,,,,,,,,,,,,,,,,,,,,,,,,,,,,,,,,,,,,,,,,,,,,,,,,,,,,,,,,,,,,,,,,,,,,,,,,,,,,,,,,,,,,,,,,,,,https://almapay.com/fr-FR/blog/drive-to-store,2026-04-27 15:45:46
2026-04-27,https://almapay.com/fr-FR/blog/quels-outils-digitaux-pour-optimiser-vos-performances-dans-le-secteur-du-retail,text/html; charset=utf-8,200,OK,Indexable,,Quels outils digitaux pour optimiser vos performances dans le secteur du retail ?,81,715,"Découvrez nos conseils pour choisir les outils digitaux qui répondent à vos enjeux de compétitivité, de rentabilité et d’expérience client.",139,820,,0,Quels outils digitaux pour optimiser vos performances dans le secteur du retail ?,81,Outils généralistes VS solutions spécialisées,45,Choisir des outils digitaux en phase avec vos besoins actuels et futurs,71,,,,https://almapay.com/fr-FR/blog/quels-outils-digitaux-pour-optimiser-vos-performances-dans-le-secteur-du-retail,,,,,,225706,55383,55383,21.216,,1160,171,6.784,68.528,Normal,4.155,4,2,1,12,7,0,1.180,78,50,0,9,8,0,,,,,f1e5dfaa401f84a5b320ed1e106437f4,0.412,,,,,fr-FR,1.1,,,,,,,,,,,,,,,,,,,,,,,,,,,,,,,,,,,,,,,,,,,,,,,,,,,,,,,,,,,,,,,,,,,,,,,,,,,,,,,,,,,,,,,,,,,,,,,,,https://almapay.com/fr-FR/blog/quels-outils-digitaux-pour-optimiser-vos-performances-dans-le-secteur-du-retail,2026-04-27 15:45:46
2026-04-27,https://almapay.com/fr-FR/blog/multicanal,text/html; charset=utf-8,200,OK,Indexable,,"Multicanal : définition, fonctionnement et avantages | Alma",59,526,"Découvrez le guide complet du commerce multicanal : définition, exemples et avantages pour vous aider à étendre vos canaux de vente et de communication.",152,964,,0,Commerce multicanal : définition et avantages pour les commerçants,66,Qu'est-ce que le commerce multicanal ?,38,Quels sont les avantages du multicanal ?,40,,,,https://almapay.com/fr-FR/blog/multicanal,,,,,,258861,62880,62880,24.088,,1837,272,6.754,72.182,Fairly Easy,5.202,4,2,1,19,9,0,1.520,86,52,0,11,10,0,,,,,ad85bb16ae46b5a161649442c091e060,0.480,,,,,fr-FR,1.1,,,,,,,,,,,,,,,,,,,,,,,,,,,,,,,,,,,,,,,,,,,,,,,,,,,,,,,,,,,,,,,,,,,,,,,,,,,,,,,,,,,,,,,,,,,,,,,,,https://almapay.com/fr-FR/blog/multicanal,2026-04-27 15:45:46
2026-04-27,https://almapay.com/fr-FR/blog/faut-il-participer-au-black-friday,text/html; charset=utf-8,200,OK,Indexable,,Commerçants : faut-il (ou non) participer au Black Friday ?,59,516,"Bien que le Black Friday soit une période commerciale forte, cela signifie aussi une forte compétition et une baisse des marges pour les commerçants.",149,915,,0,Commerçants : est-ce une bonne idée de boycotter le Black Friday ?,66,Black Friday : un événement tant attendu que décrié,51,Faut-il participer ou non au Black Friday ?,43,,,,https://almapay.com/fr-FR/blog/faut-il-participer-au-black-friday,,,,,,255265,62561,62561,23.966,,2029,283,7.170,73.679,Fairly Easy,5.696,4,2,1,7,3,0,0.510,83,55,0,10,9,0,,,,,2107db5b9b6f99962da555d51270d9e2,0.358,,,,,fr-FR,1.1,,,,,,,,,,,,,,,,,,,,,,,,,,,,,,,,,,,,,,,,,,,,,,,,,,,,,,,,,,,,,,,,,,,,,,,,,,,,,,,,,,,,,,,,,,,,,,,,,https://almapay.com/fr-FR/blog/faut-il-participer-au-black-friday,2026-04-27 15:45:46
2026-04-27,https://almapay.com/fr-FR/partenaires/technologiques,text/html; charset=utf-8,200,OK,Indexable,,Appuyez-vous sur la solution innovante d’Alma | Alma,52,476,Laissez vos clients payer à leur rythme : en plusieurs fois ou plus tard. Améliorez leur expérience de paiement et boostez votre chiffre d'affaires de 20%.,155,923,,0,Appuyez-vous sur la solution innovante d’Alma,45,Tous nos partenaires technologiques,35,Améliorez la performance de vos clients en proposant Alma,57,,,,https://almapay.com/fr-FR/partenaires/technologiques,,,,,,154073,25273,25273,9.682,,187,61,3.066,49.905,Hard,2.095,4,2,1,5,3,0,0.510,68,46,0,9,8,0,,,,,6506cb0ae346eeb182a6861a07f2c860,0.483,,,,,fr-FR,1.1,,,,,,,,,,,,,,,,,,,,,,,,,,,,,,,,,,,,,,,,,,,,,,,,,,,,,,,,,,,,,,,,,,,,,,,,,,,,,,,,,,,,,,,,,,,,,,,,,https://almapay.com/fr-FR/partenaires/technologiques,2026-04-27 15:45:46
2026-04-27,https://almapay.com/fr-FR/blog/experience-client-omnicanale,text/html; charset=utf-8,200,OK,Indexable,,Expérience client omnicanale : stratégie et mise en place,57,508,Proposer une expérience client cohérente en ligne et en boutique est essentielle pour vos clients. Comment les harmoniser ? On vous explique.,141,867,,0,Expérience client omnicanale : enjeux et mise en place,54,Qu’est-ce que l’expérience client omnicanale ?,46,Pourquoi l’omnicanalité est essentielle pour l’expérience client ?,66,,,,https://almapay.com/fr-FR/blog/experience-client-omnicanale,,,,,,253552,59682,59682,22.863,,1793,268,6.690,63.212,Normal,5.505,4,2,1,20,15,0,2.530,83,53,0,9,8,0,,,,,f1e89b144f4a19d27f8d7bb0d450bf24,0.361,,,,,fr-FR,1.1,,,,,,,,,,,,,,,,,,,,,,,,,,,,,,,,,,,,,,,,,,,,,,,,,,,,,,,,,,,,,,,,,,,,,,,,,,,,,,,,,,,,,,,,,,,,,,,,,https://almapay.com/fr-FR/blog/experience-client-omnicanale,2026-04-27 15:45:46
2026-04-27,https://almapay.com/fr-FR/blog/click-and-mortar,text/html; charset=utf-8,200,OK,Indexable,,Click and Mortar : définition et exemples de stratégies,55,482,Le Click and Mortar désigne les commerces physiques qui se lancent dans la vente e-commerce. Comment y parvenir ? Découvrez ce concept et des conseils.,151,961,,0,Click and Mortar : définition et exemples de stratégies,55,Qu’est-ce que le Click and mortar ?,35,Pourquoi les commerçants se tournent vers le Click and Mortar ?,63,,,,https://almapay.com/fr-FR/blog/click-and-mortar,,,,,,256184,65673,65673,25.158,,2043,291,7.021,75.687,Fairly Easy,5.654,4,2,1,7,3,0,0.510,89,60,0,12,11,0,,,,,521ff168951335cb8ebf8a98635f6a13,0.379,,,,,fr-FR,1.1,,,,,,,,,,,,,,,,,,,,,,,,,,,,,,,,,,,,,,,,,,,,,,,,,,,,,,,,,,,,,,,,,,,,,,,,,,,,,,,,,,,,,,,,,,,,,,,,,https://almapay.com/fr-FR/blog/click-and-mortar,2026-04-27 15:45:46
2026-04-27,https://almapay.com/fr-FR/blog/retour-sur-notre-atelier-au-ccx-circle-contentsquare,text/html; charset=utf-8,200,OK,Indexable,,Retour sur notre atelier au CX Circle Contentsquare | Alma,58,519,"Retrouvez un résumé des échanges de Antoine de la Rivière, VP Sales chez Alma était accompagné par Douglas Studient, Directeur Commercial d’IPLN syr le thème du paiement en plusieurs fois comme levier...",203,1279,,0,Retour sur notre atelier au CX Circle Contentsquare,51,,0,,0,,,,https://almapay.com/fr-FR/blog/retour-sur-notre-atelier-au-ccx-circle-contentsquare,,,,,,238775,59555,59555,22.814,,1819,244,7.455,70.159,Fairly Easy,5.645,4,2,1,3,2,0,0.340,79,53,0,9,8,0,,,,,f60a677846e3cec9e538df86115ef318,0.412,,,,,fr-FR,1.1,,,,,,,,,,,,,,,,,,,,,,,,,,,,,,,,,,,,,,,,,,,,,,,,,,,,,,,,,,,,,,,,,,,,,,,,,,,,,,,,,,,,,,,,,,,,,,,,,https://almapay.com/fr-FR/blog/retour-sur-notre-atelier-au-ccx-circle-contentsquare,2026-04-27 15:45:46
2026-04-27,https://almapay.com/fr-FR/blog/page-faq-ecommerce,text/html; charset=utf-8,200,OK,Indexable,,Page FAQ e-commerce : conseils pour rédiger et exemples,55,523,La page FAQ offre aux clients des réponses rapides à leurs questions. Cela améliore la confiance et désengorge le service client. On vous explique.,147,894,,0,Page FAQ e-commerce : 5 conseils de rédaction et exemples,57,Qu’est-ce qu’une page FAQ e-commerce ?,38,En quoi la page FAQ est importante pour un site e-commerce ?,60,,,,https://almapay.com/fr-FR/blog/page-faq-ecommerce,,,,,,270752,67013,67013,25.671,,2514,380,6.616,68.812,Normal,6.668,4,2,1,9,3,0,0.510,81,51,0,12,11,0,,,,,67ccdd718fb2325ffbd673bff4724c55,0.376,,,,,fr-FR,1.1,,,,,,,,,,,,,,,,,,,,,,,,,,,,,,,,,,,,,,,,,,,,,,,,,,,,,,,,,,,,,,,,,,,,,,,,,,,,,,,,,,,,,,,,,,,,,,,,,https://almapay.com/fr-FR/blog/page-faq-ecommerce,2026-04-27 15:45:47
2026-04-27,https://almapay.com/fr-FR/blog/merchandising,text/html; charset=utf-8,200,OK,Indexable,,Merchandising : définition et comment le mettre en place,56,511,Découvrez le guide du merchandising ! Comprendre ce concept et 5 leviers pour optimiser la mise en avant de vos produits afin de mieux vendre en magasin.,153,957,,0,Merchandising : définition et mise en place pour les commerçants,64,Qu’est-ce que le merchandising ?,32,Quel est le rôle du merchandising ?,35,,,,https://almapay.com/fr-FR/blog/merchandising,,,,,,264809,69886,69886,26.772,,3059,425,7.198,72.422,Fairly Easy,8.010,4,2,1,13,7,0,1.180,81,49,0,9,8,0,,,,,aa98892c89fcb7c31707797819bd1a9d,0.408,,,,,fr-FR,1.1,,,,,,,,,,,,,,,,,,,,,,,,,,,,,,,,,,,,,,,,,,,,,,,,,,,,,,,,,,,,,,,,,,,,,,,,,,,,,,,,,,,,,,,,,,,,,,,,,https://almapay.com/fr-FR/blog/merchandising,2026-04-27 15:45:47
2026-04-27,https://almapay.com/fr-FR/blog/retail-media,text/html; charset=utf-8,200,OK,Indexable,,Retail Media : définition et enjeux pour les commerçants,56,502,Faites-vous de la publicité pour votre magasin ? Découvrez comment le Retail Media permet de gagner en visibilité et de booster les ventes d’un commerce.,153,947,,0,Retail Media : définition et enjeux pour les commerçants,56,Qu’est-ce que le retail media ?,31,En quoi le retail media influence l’achat ?,43,,,,https://almapay.com/fr-FR/blog/retail-media,,,,,,247204,61249,61249,23.463,,1891,260,7.273,71.054,Fairly Easy,5.450,4,2,1,8,3,0,0.510,82,53,0,11,10,0,,,,,7185cf23260b16cc6f8f879324bca23,0.432,,,,,fr-FR,1.1,,,,,,,,,,,,,,,,,,,,,,,,,,,,,,,,,,,,,,,,,,,,,,,,,,,,,,,,,,,,,,,,,,,,,,,,,,,,,,,,,,,,,,,,,,,,,,,,,https://almapay.com/fr-FR/blog/retail-media,2026-04-27 15:45:47
2026-04-27,https://almapay.com/fr-FR/blog/accueil-des-clients-en-magasin,text/html; charset=utf-8,200,OK,Indexable,,Accueil des clients en magasin : 8 conseils pour réussir,56,490,La première impression en boutique influence le comportement d’achat des clients. Comment faire le meilleur accueil possible ? On vous explique tout.,149,919,,0,Comment améliorer et réussir l’accueil des clients en magasin ?,63,Pourquoi est-ce important de réussir l’accueil en magasin ?,59,8 meilleures techniques pour améliorer l’accueil client,55,,,,https://almapay.com/fr-FR/blog/accueil-des-clients-en-magasin,,,,,,277498,69978,69978,26.807,,2618,353,7.416,75.445,Fairly Easy,6.550,4,2,1,8,4,0,0.670,82,52,0,11,10,0,,,,,b054ae75b0b2ac320b868ce0b0045fb6,0.408,,,,,fr-FR,1.1,,,,,,,,,,,,,,,,,,,,,,,,,,,,,,,,,,,,,,,,,,,,,,,,,,,,,,,,,,,,,,,,,,,,,,,,,,,,,,,,,,,,,,,,,,,,,,,,,https://almapay.com/fr-FR/blog/accueil-des-clients-en-magasin,2026-04-27 15:45:47
2026-04-27,https://almapay.com/fr-FR/blog/politique-de-retour-ecommerce,text/html; charset=utf-8,200,OK,Indexable,,Politique de retour e-commerce : conditions et conseils,55,491,Vous devez définir une politique de retour pour garantir les bonnes conditions d’échange et de remboursement pour l’e-commerce. On vous explique.,145,911,,0,Comment gérer votre politique de retour e-commerce ?,52,En quoi consiste une politique de retour ?,42,Pourquoi faut-il avoir une politique de retour ?,48,,,,https://almapay.com/fr-FR/blog/politique-de-retour-ecommerce,,,,,,255754,61512,61512,23.564,,2065,315,6.556,73.752,Fairly Easy,5.851,4,2,1,11,3,0,0.510,86,56,0,11,10,0,,,,,3e7b2f1a5683f2d0e99bc9c3a21a2b1e,0.455,,,,,fr-FR,1.1,,,,,,,,,,,,,,,,,,,,,,,,,,,,,,,,,,,,,,,,,,,,,,,,,,,,,,,,,,,,,,,,,,,,,,,,,,,,,,,,,,,,,,,,,,,,,,,,,https://almapay.com/fr-FR/blog/politique-de-retour-ecommerce,2026-04-27 15:45:47
2026-04-27,https://almapay.com/fr-FR/blog/soldes-ete-date-fonctionnement,text/html; charset=utf-8,200,OK,Indexable,,Soldes d’été 2024 : dates et réglementation des marchands,57,530,Les soldes d’été commencent le 26 juin 2024 et se terminent le 23 juillet 2024. Comment se préparer en tant que commerçant ? On vous explique en détail.,152,944,,0,Soldes d'été 2026 : dates officielles et fonctionnement,55,Quelles sont les dates pour les soldes d’été ?,46,Quels sont les commerçants éligibles aux soldes d’été ?,55,,,,https://almapay.com/fr-FR/blog/soldes-ete-date-fonctionnement,,,,,,257245,60858,60858,23.314,,1903,258,7.376,76.383,Fairly Easy,5.388,4,2,1,14,9,0,1.520,86,55,0,11,10,0,,,,,41c6e430c9b4077cdb3185da34ce72c8,0.439,,,,,fr-FR,1.1,,,,,,,,,,,,,,,,,,,,,,,,,,,,,,,,,,,,,,,,,,,,,,,,,,,,,,,,,,,,,,,,,,,,,,,,,,,,,,,,,,,,,,,,,,,,,,,,,https://almapay.com/fr-FR/blog/soldes-ete-date-fonctionnement,2026-04-27 15:45:47
2026-04-27,https://almapay.com/fr-FR/blog/preuve-sociale,text/html; charset=utf-8,200,OK,Indexable,,Preuve sociale : 9 exemples pour booster votre marketing,56,514,"La preuve sociale est un biais psychologique qui permet de faciliter l’acte d’achat. C’est l’effet moutonnier, ou l’effet d’entraînement. On vous explique.",155,919,,0,9 exemples de preuves sociales pour améliorer vos ventes,56,Qu’est-ce que la preuve sociale ?,33,Pourquoi activer la preuve sociale dans sa stratégie ?,54,,,,https://almapay.com/fr-FR/blog/preuve-sociale,,,,,,244331,59864,59864,22.933,,1847,249,7.418,58.917,Fairly Hard,5.783,4,2,1,15,10,0,1.680,83,55,0,9,8,0,,,,,4e31d338c4689f112c582412dac99a26,0.438,,,,,fr-FR,1.1,,,,,,,,,,,,,,,,,,,,,,,,,,,,,,,,,,,,,,,,,,,,,,,,,,,,,,,,,,,,,,,,,,,,,,,,,,,,,,,,,,,,,,,,,,,,,,,,,https://almapay.com/fr-FR/blog/preuve-sociale,2026-04-27 15:45:47
2026-04-27,https://almapay.com/fr-FR/blog/l-oeil-expert-de-wizishop-sur-le-e-commerce,text/html; charset=utf-8,200,OK,Indexable,,L’oeil expert de WiziShop sur le e-commerce | Alma,50,458,Comment WiziShop aide au quotidien les e-marchands et est devenue un acteur incontournable de la scène digitale.,112,709,,0,L’oeil expert de WiziShop sur le e-commerce,43,WiziShop en quelques chiffres :,31,Les tendances du e-commerce selon WiziShop,42,,,,https://almapay.com/fr-FR/blog/l-oeil-expert-de-wizishop-sur-le-e-commerce,,,,,,283702,75537,75537,28.937,,3430,451,7.605,68.763,Normal,8.479,4,2,1,9,3,0,0.510,77,49,0,14,12,0,,,,,2d131934875dcdef03fd26532a0386d7,0.375,,,,,fr-FR,1.1,,,,,,,,,,,,,,,,,,,,,,,,,,,,,,,,,,,,,,,,,,,,,,,,,,,,,,,,,,,,,,,,,,,,,,,,,,,,,,,,,,,,,,,,,,,,,,,,,https://almapay.com/fr-FR/blog/l-oeil-expert-de-wizishop-sur-le-e-commerce,2026-04-27 15:45:47
