crawl_date,Address,Content_Type,Status_Code,Status,Indexability,Indexability_Status,Title_1,Title_1_Length,Title_1_Pixel_Width,Meta_Description_1,Meta_Description_1_Length,Meta_Description_1_Pixel_Width,Meta_Keywords_1,Meta_Keywords_1_Length,H1_1,H1_1_Length,H2_1,H2_1_Length,H2_2,H2_2_Length,Meta_Robots_1,X_Robots_Tag_1,Meta_Refresh_1,Canonical_Link_Element_1,rel_next_1,rel_prev_1,HTTP_rel_next_1,HTTP_rel_prev_1,amphtml_Link_Element,Size_bytes,Transferred_bytes,Total_Transferred_bytes,CO2_mg,Carbon_Rating,Word_Count,Sentence_Count,Average_Words_Per_Sentence,Flesch_Reading_Ease_Score,Readability,Text_Ratio,Crawl_Depth,Folder_Depth,Link_Score,Inlinks,Unique_Inlinks,Unique_JS_Inlinks,of_Total,Outlinks,Unique_Outlinks,Unique_JS_Outlinks,External_Outlinks,Unique_External_Outlinks,Unique_External_JS_Outlinks,Closest_Near_Duplicate_Match,No_Near_Duplicates,Spelling_Errors,Grammar_Errors,Hash,Response_Time,Last_Modified,Redirect_URL,Redirect_Type,Cookies,Language,HTTP_Version,Clicks,Impressions,CTR,Position,URL_Inspection_API_Status,URL_Inspection_API_Error,Summary,Coverage,Last_Crawl,Days_Since_Last_Crawled,Crawled_As,Crawl_Allowed,Page_Fetch,Indexing_Allowed,User_Declared_Canonical,Google_Selected_Canonical,Mobile_Usability,Mobile_Usability_Issues,AMP_Results,AMP_Issues,Rich_Results,Rich_Results_Types,Rich_Results_Type_Errors,Rich_Results_Type_Warnings,Performance_Score,First_Contentful_Paint_Time_ms,Speed_Index_Time_ms,Largest_Contentful_Paint_Time_ms,Time_to_Interactive_ms,Total_Blocking_Time_ms,Cumulative_Layout_Shift,Total_Size_Savings_Bytes,Total_Time_Savings_ms,Total_Requests,Total_Page_Size_Bytes,HTML_Size_Bytes,HTML_Count,Image_Size_Bytes,Image_Count,CSS_Size_Bytes,CSS_Count,JavaScript_Size_Bytes,JavaScript_Count,Font_Size_Bytes,Font_Count,Media_Size_Bytes,Media_Count,Other_Size_Bytes,Other_Count,Third_Party_Size_Bytes,Third_Party_Count,Core_Web_Vitals_Assessment,CrUX_Largest_Contentful_Paint_Time_ms,CrUX_Interaction_to_Next_Paint_ms,CrUX_Cumulative_Layout_Shift,CrUX_First_Contentful_Paint_Time_ms,Minify_CSS_Savings_ms,Minify_CSS_Savings_Bytes,Minify_JavaScript_Savings_ms,Minify_JavaScript_Savings_Bytes,Reduce_Unused_CSS_Savings_ms,Reduce_Unused_CSS_Savings_Bytes,Reduce_Unused_JavaScript_Savings_ms,Reduce_Unused_JavaScript_Savings_Bytes,JavaScript_Execution_Time_ms,JavaScript_Execution_Time_Category,Minimize_Main_Thread_Work_ms,Minimize_Main_Thread_Work_Category,Network_Payload_Size_Bytes,User_Timing_Marks_and_Measures,Number_of_Redirects,Server_Responds_Quickly,Applies_Text_Compression,LCP_Request_Discovery,LCP_Breakdown,Render_Blocking_Requests_Savings_ms,Preconnect_Candidates_Savings_ms,Maximum_Critical_Path_Latency_ms,Use_Efficient_Cache_Lifetimes_Savings_Bytes,Layout_Shift_Culprits,DOM_Size,Improve_Image_Delivery_Savings_Bytes,Forced_Reflow_Savings_ms,Legacy_JavaScript_Savings_Bytes,Duplicated_JavaScript_Bytes,Font_Display_Savings_ms,3rd_Parties,Target_Size,Content_Width,Font_Display_Size,Viewport,Mobile_Alternate_Link,Closest_Semantically_Similar_Address,Semantic_Similarity_Score,No_Semantically_Similar,Semantic_Relevance_Score,URL_Encoded_Address,Crawl_Timestamp
2026-04-27,https://almapay.com/sitemap.xml,application/xml,200,OK,Indexable,,,0,0,,0,0,,0,,0,,0,,0,,,,,,,,,,185,150,150,0.057,,0,,,,,0.000,0,0,,0,0,0,0.000,0,0,0,0,0,0,,,,,74107fc27986851fc3be882bb09aea68,0.215,"Mon, 27 Apr 2026 15:43:46 GMT",,,,,1.1,,,,,,,,,,,,,,,,,,,,,,,,,,,,,,,,,,,,,,,,,,,,,,,,,,,,,,,,,,,,,,,,,,,,,,,,,,,,,,,,,,,,,,,,,,,,,,,,,https://almapay.com/sitemap.xml,2026-04-27 15:43:46
2026-04-27,https://almapay.com/sitemap-0.xml,application/xml,200,OK,Indexable,,,0,0,,0,0,,0,,0,,0,,0,,,,,,,,,,101847,7278,7278,2.788,,0,,,,,0.000,,0,,0,0,0,0.000,0,0,0,0,0,0,,,,,91b996e534a8bfd8bdcef4f6a5fb81bf,0.223,"Mon, 27 Apr 2026 15:43:48 GMT",,,,,1.1,,,,,,,,,,,,,,,,,,,,,,,,,,,,,,,,,,,,,,,,,,,,,,,,,,,,,,,,,,,,,,,,,,,,,,,,,,,,,,,,,,,,,,,,,,,,,,,,,https://almapay.com/sitemap-0.xml,2026-04-27 15:43:48
2026-04-27,https://almapay.com/,text/html; charset=utf-8,200,OK,Indexable,,Payment in installments. Simple. Guaranteed. | Alma,51,471,Let your customers pay at their own pace: in instalments or later. Improve their payment experience and boost your turnover by 20%.,131,816,,0,Flexible and guaranteed instalment payments,43,An essential performance driver,31,A trusted solution for merchants,32,,,,https://almapay.com/,,,,,,250072,56507,56507,21.647,,1502,242,6.207,67.834,Normal,4.144,0,0,100,1507,590,0,99.330,55,27,0,12,9,0,,,,,a2d9f4d218d25d912665b60c36b3e34,0.119,,,,,en-FR,1.1,,,,,,,,,,,,,,,,,,,,,,,,,,,,,,,,,,,,,,,,,,,,,,,,,,,,,,,,,,,,,,,,,,,,,,,,,,,,,,,,,,,,,,,,,,,,,,,,,https://almapay.com/,2026-04-27 15:43:46
2026-04-27,https://almapay.com/products/payment-in-2-3-or-4-installments,text/html; charset=utf-8,200,OK,Indexable,,Boost your sales with payment in instalments | Alma,51,466,Let your customers pay at their own pace: in instalments or later. Improve their payment experience and boost your turnover by 20%.,131,816,,0,"Boost your sales with payments in 2, 3, or 4 installments",57,Accelerate your growth with split payments,42,An essential sales lever,24,,,,https://almapay.com/products/payment-in-2-3-or-4-installments,,,,,,270695,65250,65250,24.996,,1223,204,5.995,69.319,Normal,3.149,1,1,16,105,51,0,8.590,61,26,0,10,9,0,,,,,fa88e3d9d5668be58b0fdb31b9219bb7,0.098,,,,,en-FR,1.1,,,,,,,,,,,,,,,,,,,,,,,,,,,,,,,,,,,,,,,,,,,,,,,,,,,,,,,,,,,,,,,,,,,,,,,,,,,,,,,,,,,,,,,,,,,,,,,,,https://almapay.com/products/payment-in-2-3-or-4-installments,2026-04-27 15:43:57
2026-04-27,https://almapay.com/global,text/html; charset=utf-8,200,OK,Indexable,,Alma in your country! | Alma,28,249,Let your customers pay at their own pace: in instalments or later. Improve their payment experience and boost your turnover by 20%.,131,816,,0,Alma in your country!,21,Your country is not on the list?,32,,0,,,,https://almapay.com/global,,,,,,141208,31655,31655,12.126,,106,27,3.926,90.316,Very Easy,1.206,1,0,63,291,289,0,48.650,54,26,0,10,9,0,,,,,7787e7ef4787a8d6d623f4592fd705d,0.141,,,,,en-FR,1.1,,,,,,,,,,,,,,,,,,,,,,,,,,,,,,,,,,,,,,,,,,,,,,,,,,,,,,,,,,,,,,,,,,,,,,,,,,,,,,,,,,,,,,,,,,,,,,,,,https://almapay.com/global,2026-04-27 15:43:59
2026-04-27,https://almapay.com/fr-BE,text/html; charset=utf-8,200,OK,Indexable,,La solution de paiement en plusieurs fois - Simple avec Alma,60,543,Offrez le paiement en plusieurs fois en ligne et en boutique à vos clients. Jusqu'à 15% de conversions en plus. Installation rapide et sans frais cachés.,153,913,,0,"Le paiement en plusieurs fois, flexible et garanti",50,Un levier de performance incontournable,39,Une solution de confiance pour les commerçants,46,,,,https://almapay.com/fr-BE,,,,,,248930,58671,58671,22.476,,1765,261,6.762,74.006,Fairly Easy,4.824,1,0,48,990,468,0,78.790,54,24,0,12,9,0,,,,,5e32ef246333d64aeb99635a404b9278,0.050,,,,,fr-BE,1.1,,,,,,,,,,,,,,,,,,,,,,,,,,,,,,,,,,,,,,,,,,,,,,,,,,,,,,,,,,,,,,,,,,,,,,,,,,,,,,,,,,,,,,,,,,,,,,,,,https://almapay.com/fr-BE,2026-04-27 15:44:00
2026-04-27,https://almapay.com/fr-FR/blog/comment-fideliser-un-client,text/html; charset=utf-8,200,OK,Indexable,,"Fidéliser un client : stratégies, actions et conseils | Alma",60,499,Fidéliser un client est plus simple et moins coûteux qu’acquérir un nouveau client. Comment fidéliser sa clientèle ? Quelle stratégie ? On vous explique.,153,915,,0,Comment fidéliser un client : 5 conseils pour y arriver,55,Quels sont les enjeux de la fidélisation client ?,49,Quelles sont les étapes pour fidéliser un client ?,50,,,,https://almapay.com/fr-FR/blog/comment-fideliser-un-client,,,,,,246097,58917,58917,22.570,,1710,226,7.566,69.781,Normal,5.233,3,2,1,25,18,0,3.030,81,53,0,10,9,0,,,,,9057cca02ce142bdd9a33c3d71075fa1,0.405,,,,,fr-FR,1.1,,,,,,,,,,,,,,,,,,,,,,,,,,,,,,,,,,,,,,,,,,,,,,,,,,,,,,,,,,,,,,,,,,,,,,,,,,,,,,,,,,,,,,,,,,,,,,,,,https://almapay.com/fr-FR/blog/comment-fideliser-un-client,2026-04-27 15:43:50
2026-04-27,https://almapay.com/fr-FR/blog/agencement-point-de-vente,text/html; charset=utf-8,200,OK,Indexable,,Agencement d’un point de vente : conseils pour le réussir,57,508,L’aménagement d’un point de vente influence vos performances commerciales. Comment agencer une boutique pour mieux vendre ? On vous explique.,141,928,,0,6 conseils pour l’aménagement d’un point de vente,49,Pourquoi est-il important de bien agencer son point de vente ?,62,1/ Une vitrine captivante pour attirer les clients,50,,,,https://almapay.com/fr-FR/blog/agencement-point-de-vente,,,,,,231392,55059,55059,21.092,,1301,178,7.309,73.914,Fairly Easy,4.407,4,2,1,22,13,0,2.190,86,52,0,9,8,0,,,,,3f62d8483caf26b45a6c384d6d4b5bef,0.454,,,,,fr-FR,1.1,,,,,,,,,,,,,,,,,,,,,,,,,,,,,,,,,,,,,,,,,,,,,,,,,,,,,,,,,,,,,,,,,,,,,,,,,,,,,,,,,,,,,,,,,,,,,,,,,https://almapay.com/fr-FR/blog/agencement-point-de-vente,2026-04-27 15:43:50
2026-04-27,https://almapay.com/fr-FR/blog/page-categorie-ecommerce,text/html; charset=utf-8,200,OK,Indexable,,Page catégorie e-commerce : comment l’optimiser et exemples,59,568,La page catégorie facilite la recherche de produits et de services selon les critères de recherches de chacun. Comment l’optimiser ? On vous explique.,150,910,,0,Page catégorie e-commerce : 5 conseils d’optimisation et exemples,65,En quoi les pages catégories e-commerce sont importantes ?,58,Quels sont les éléments essentiels d’une page catégorie ?,57,,,,https://almapay.com/fr-FR/blog/page-categorie-ecommerce,,,,,,252095,62537,62537,23.957,,1887,278,6.788,68.809,Normal,5.558,4,2,1,9,5,0,0.840,77,50,0,10,9,0,,,,,67f1079689d24f24a2064e88cf1b3577,0.508,,,,,fr-FR,1.1,,,,,,,,,,,,,,,,,,,,,,,,,,,,,,,,,,,,,,,,,,,,,,,,,,,,,,,,,,,,,,,,,,,,,,,,,,,,,,,,,,,,,,,,,,,,,,,,,https://almapay.com/fr-FR/blog/page-categorie-ecommerce,2026-04-27 15:43:50
2026-04-27,https://almapay.com/es-ES/blog/como-prensa-stove-aumenta-su-ticket-medio-mas-de-un-20-con-alma,text/html; charset=utf-8,200,OK,Indexable,,¿Cómo Prensa Stove aumenta su ticket medio más de un 20% con Alma?,66,651,Prensa Stove ofrece la oportunidad de pagar a su propio propio ritmo mediante el pago a plazos. ¿Cómo han conseguido aumentar sus ventas?,137,885,,0,¿Cómo Prensa Stove aumenta su ticket medio más de un 20% con Alma?,66,,0,,0,,,,https://almapay.com/es-ES/blog/como-prensa-stove-aumenta-su-ticket-medio-mas-de-un-20-con-alma,,,,,,142732,39044,39044,14.957,,487,65,7.492,56.783,Fairly Hard,2.634,3,2,1,5,4,0,0.670,46,24,0,10,8,0,,,,,2e357070a0ef54e33ea94583845599c2,0.566,,,,,es-ES,1.1,,,,,,,,,,,,,,,,,,,,,,,,,,,,,,,,,,,,,,,,,,,,,,,,,,,,,,,,,,,,,,,,,,,,,,,,,,,,,,,,,,,,,,,,,,,,,,,,,https://almapay.com/es-ES/blog/como-prensa-stove-aumenta-su-ticket-medio-mas-de-un-20-con-alma,2026-04-27 15:43:50
2026-04-27,https://almapay.com/pages/leadership-principles,text/html; charset=utf-8,200,OK,Non-Indexable,noindex,Leadership and communication principles at Alma | Alma,54,509,Let your customers pay at their own pace: in instalments or later. Improve their payment experience and boost your turnover by 20%.,131,816,,0,Our leadership and communication principles,43,The Alma philosophy,19,"Why we care about leadership (and why you should, too)",54,noindex,,,https://almapay.com/pages/leadership-principles,,,,,,177514,45017,45017,17.245,,1547,218,7.096,76.970,Fairly Easy,5.620,1,1,12,46,43,0,7.240,49,26,0,13,10,0,,,,,849e293c3d1307b4934eb5e5a393586f,0.054,,,,,en-FR,1.1,,,,,,,,,,,,,,,,,,,,,,,,,,,,,,,,,,,,,,,,,,,,,,,,,,,,,,,,,,,,,,,,,,,,,,,,,,,,,,,,,,,,,,,,,,,,,,,,,https://almapay.com/pages/leadership-principles,2026-04-27 15:44:01
2026-04-27,https://almapay.com/de-DE,text/html; charset=utf-8,200,OK,Indexable,,Die Ratenzahlung. Einfach. Garantiert. | Alma,45,400,Lassen Sie Ihre Kunden in ihrem eigenen Tempo bezahlen: in Raten oder später. Verbessern Sie ihr Zahlungserlebnis und steigern Sie Ihren Umsatz um 20 %.,152,955,,0,Erleichtern Sie hochpreisige Käufe mit sicherer Ratenzahlung,60,Ein entscheidender Erfolgsfaktor,32,Eine vertrauenswürdige Lösung für Händler,41,,,,https://almapay.com/de-DE,,,,,,207391,53005,53005,20.305,,736,143,5.147,49.193,Hard,2.988,1,0,49,973,447,0,75.250,43,20,0,11,8,0,,,,,65091ac95f6afe6df03e7bfd447cef62,0.045,,,,,de-DE,1.1,,,,,,,,,,,,,,,,,,,,,,,,,,,,,,,,,,,,,,,,,,,,,,,,,,,,,,,,,,,,,,,,,,,,,,,,,,,,,,,,,,,,,,,,,,,,,,,,,https://almapay.com/de-DE,2026-04-27 15:44:01
2026-04-27,https://almapay.com/it-IT,text/html; charset=utf-8,200,OK,Indexable,,Il pagamento a rate. Semplice. Garantito. | Alma,48,428,Lascia che i tuoi clienti paghino al loro ritmo: a rate o successivamente. Migliora la loro esperienza di pagamento e aumenta il tuo fatturato del 20%.,151,905,,0,Il pagamento a rate. Semplice. Garantito.,41,Un acceleratore di performance essenziale,41,Una soluzione di fiducia per i commercianti,43,,,,https://almapay.com/it-IT,,,,,,249499,59807,59807,22.911,,1341,213,6.296,28.217,Very Hard,3.838,1,0,47,957,376,0,63.300,54,26,0,11,8,0,,,,,b71cd178baa800095e4292427e6ae113,0.049,,,,,it-IT,1.1,,,,,,,,,,,,,,,,,,,,,,,,,,,,,,,,,,,,,,,,,,,,,,,,,,,,,,,,,,,,,,,,,,,,,,,,,,,,,,,,,,,,,,,,,,,,,,,,,https://almapay.com/it-IT,2026-04-27 15:44:01
2026-04-27,https://almapay.com/blog,text/html; charset=utf-8,200,OK,Indexable,,Latest updates and news | Alma,30,286,"All the news from Alma, Fintech and the merchant world.",55,349,,0,Reinventing the relationship between merchants and consumers in Europe,70,Alma,4,News,4,,,,https://almapay.com/blog,,,,,,172847,37815,37815,14.486,,233,47,4.957,71.454,Fairly Easy,1.493,1,0,13,73,51,0,8.590,63,34,0,10,9,0,,,,,cb1f0913c5b30a687158135b64abebd5,0.043,,,,,en-FR,1.1,,,,,,,,,,,,,,,,,,,,,,,,,,,,,,,,,,,,,,,,,,,,,,,,,,,,,,,,,,,,,,,,,,,,,,,,,,,,,,,,,,,,,,,,,,,,,,,,,https://almapay.com/blog,2026-04-27 15:44:02
2026-04-27,https://almapay.com/products/pay-later,text/html; charset=utf-8,200,OK,Indexable,,"Boost your sales now, your customers pay later | Alma",53,479,Let your customers pay at their own pace: in instalments or later. Improve their payment experience and boost your turnover by 20%.,131,816,,0,"Boost your sales now, your customers pay later",46,"Two options, twice the flexibility",34,Offer Pay Later online and in-store,35,,,,https://almapay.com/products/pay-later,,,,,,225571,52776,52776,20.217,,499,95,5.253,82.487,Easy,1.760,1,1,16,103,50,0,8.420,57,26,0,10,9,0,,,,,76f8aef3eb77e53006276f40954e65bd,0.077,,,,,en-FR,1.1,,,,,,,,,,,,,,,,,,,,,,,,,,,,,,,,,,,,,,,,,,,,,,,,,,,,,,,,,,,,,,,,,,,,,,,,,,,,,,,,,,,,,,,,,,,,,,,,,https://almapay.com/products/pay-later,2026-04-27 15:44:02
2026-04-27,https://almapay.com/nl-NL,text/html; charset=utf-8,200,OK,Indexable,,Meer verkopen met Alma. Het ultieme betaalgemak.  | Alma,56,530,"Laat klanten zorgeloos in meerdere termijnen betalen, terwijl jij direct uitbetaald krijgt.",91,524,,0,Eenvoudig en veilig gespreid betalen,36,Een onmisbare prestatiehefboom,30,Een betrouwbare oplossing voor handelaars,41,,,,https://almapay.com/nl-NL,,,,,,242135,57331,57331,21.962,,1464,249,5.880,53.915,Fairly Hard,4.385,1,0,48,950,445,0,74.920,53,24,0,12,9,0,,,,,db9efbaba3273d65c6648b0745d94a85,0.172,,,,,nl-NL,1.1,,,,,,,,,,,,,,,,,,,,,,,,,,,,,,,,,,,,,,,,,,,,,,,,,,,,,,,,,,,,,,,,,,,,,,,,,,,,,,,,,,,,,,,,,,,,,,,,,https://almapay.com/nl-NL,2026-04-27 15:44:02
2026-04-27,https://almapay.com/pages/case-studies,text/html; charset=utf-8,200,OK,Indexable,,They chose Alma | Alma,22,215,Let your customers pay at their own pace: in instalments or later. Improve their payment experience and boost your turnover by 20%.,131,816,,0,They chose Alma,15,Join more than 21 000 brands who trust Alma,43,,0,,,,https://almapay.com/pages/case-studies,,,,,,148536,36896,36896,14.134,,253,36,7.028,74.641,Fairly Easy,1.782,1,1,13,49,44,0,7.410,54,29,0,10,9,0,,,,,2c86635070ddc2669053892ac9f17eb2,0.051,,,,,en-FR,1.1,,,,,,,,,,,,,,,,,,,,,,,,,,,,,,,,,,,,,,,,,,,,,,,,,,,,,,,,,,,,,,,,,,,,,,,,,,,,,,,,,,,,,,,,,,,,,,,,,https://almapay.com/pages/case-studies,2026-04-27 15:44:02
2026-04-27,https://almapay.com/legal/legal-notice,text/html,308,Permanent Redirect,Non-Indexable,Redirected,,0,0,,0,0,,0,,0,,0,,0,,,,,,,,,,0,0,0,0.000,,0,,,,,0.000,1,1,,62,53,0,8.920,0,0,0,0,0,0,,,,,,0.047,,https://almapay.com/fr-FR/legal/mentions-legales,HTTP Redirect,,,1.1,,,,,,,,,,,,,,,,,,,,,,,,,,,,,,,,,,,,,,,,,,,,,,,,,,,,,,,,,,,,,,,,,,,,,,,,,,,,,,,,,,,,,,,,,,,,,,,,,https://almapay.com/legal/legal-notice,2026-04-27 15:44:03
2026-04-27,https://almapay.com/pricing,text/html; charset=utf-8,200,OK,Indexable,,Our pricing | Alma,18,159,Let your customers pay at their own pace: in instalments or later. Improve their payment experience and boost your turnover by 20%.,131,816,,0,,0,Our fees,8,Up to €1M of turnover,21,,,,https://almapay.com/pricing,,,,,,178156,41647,41647,15.954,,784,142,5.521,79.403,Fairly Easy,3.141,1,0,15,107,51,0,8.590,55,26,0,12,11,0,,,,,72f8996355c1d3ada4b6d9017e28e8b0,0.064,,,,,en-FR,1.1,,,,,,,,,,,,,,,,,,,,,,,,,,,,,,,,,,,,,,,,,,,,,,,,,,,,,,,,,,,,,,,,,,,,,,,,,,,,,,,,,,,,,,,,,,,,,,,,,https://almapay.com/pricing,2026-04-27 15:44:03
2026-04-27,https://almapay.com/products/payment-in-10-or-12-installments,text/html; charset=utf-8,200,OK,Indexable,,Convert large shopping carts with Alma | Alma,45,413,Let your customers pay at their own pace: in instalments or later. Improve their payment experience and boost your turnover by 20%.,131,816,,0,Convert large shopping carts with Alma.,39,Get on the waiting list,23,A purchase up to 12x more flexible,34,,,,https://almapay.com/products/payment-in-10-or-12-installments,,,,,,172193,42467,42467,16.268,,317,55,5.764,75.553,Fairly Easy,1.743,1,1,13,94,45,0,7.580,52,26,0,12,10,0,,,,,557268aa2fa268a7238a26acc05e113e,0.066,,,,,en-FR,1.1,,,,,,,,,,,,,,,,,,,,,,,,,,,,,,,,,,,,,,,,,,,,,,,,,,,,,,,,,,,,,,,,,,,,,,,,,,,,,,,,,,,,,,,,,,,,,,,,,https://almapay.com/products/payment-in-10-or-12-installments,2026-04-27 15:44:03
2026-04-27,https://almapay.com/demo,text/html; charset=utf-8,200,OK,Indexable,,Request a demo | Alma,21,207,Let your customers pay at their own pace: in instalments or later. Improve their payment experience and boost your turnover by 20%.,131,816,,0,Request a demo,14,"Increase your sales, just like the 21 000 brands already using Alma",67,,0,,,,https://almapay.com/demo,,,,,,133112,34023,34023,13.034,,106,22,4.818,67.862,Normal,1.341,1,0,16,137,51,0,8.590,50,26,0,10,9,0,,,,,47589827e0aaecfea94b741325453599,0.050,,,,,en-FR,1.1,,,,,,,,,,,,,,,,,,,,,,,,,,,,,,,,,,,,,,,,,,,,,,,,,,,,,,,,,,,,,,,,,,,,,,,,,,,,,,,,,,,,,,,,,,,,,,,,,https://almapay.com/demo,2026-04-27 15:44:04
2026-04-27,https://almapay.com/pt-PT,text/html; charset=utf-8,200,OK,Indexable,,Pagamento em prestações. Simples. Garantido. | Alma,51,489,Deixe seus clientes pagarem no seu próprio ritmo: em parcelas ou mais tarde. Melhore sua experiência de pagamento e aumente seu faturamento em 20%.,147,950,,0,Os seus clientes pagam ao seu próprio ritmo. As suas vendas aumentam.,69,Venda melhor. Venda mais.,25,Simples e instantâneo,21,,,,https://almapay.com/pt-PT,,,,,,212727,41038,41038,15.721,,424,88,4.818,56.488,Fairly Hard,1.573,1,0,54,1009,484,0,81.480,45,18,0,10,9,0,,,,,19761cae452a89927bf4d8b34174f95e,0.104,,,,,pt-PT,1.1,,,,,,,,,,,,,,,,,,,,,,,,,,,,,,,,,,,,,,,,,,,,,,,,,,,,,,,,,,,,,,,,,,,,,,,,,,,,,,,,,,,,,,,,,,,,,,,,,https://almapay.com/pt-PT,2026-04-27 15:44:03
2026-04-27,https://almapay.com/nl-BE,text/html; charset=utf-8,200,OK,Indexable,,Betaling in termijnen. Eenvoudig. Gegarandeerd. | Alma,54,491,Laat uw klanten in hun eigen tempo betalen: in termijnen of later. Verbeter hun betaalervaring en verhoog uw omzet met 15%.,123,770,,0,"Gespreid betalen, flexibel en gegarandeerd.",43,Een betrouwbare oplossing voor handelaars.,42,Een onmisbare prestatiehefboom,30,,,,https://almapay.com/nl-BE,,,,,,241676,58045,58045,22.236,,1568,261,6.008,54.090,Fairly Hard,4.679,1,0,49,1012,477,0,80.300,52,23,0,12,9,0,,,,,294005c1e3a6466df78be5ad4705b1b7,0.075,,,,,nl-BE,1.1,,,,,,,,,,,,,,,,,,,,,,,,,,,,,,,,,,,,,,,,,,,,,,,,,,,,,,,,,,,,,,,,,,,,,,,,,,,,,,,,,,,,,,,,,,,,,,,,,https://almapay.com/nl-BE,2026-04-27 15:44:04
2026-04-27,https://almapay.com/fr-FR,text/html; charset=utf-8,200,OK,Indexable,,La solution de paiement en plusieurs fois - Simple avec Alma,60,543,Offrez le paiement en plusieurs fois en ligne et en boutique à vos clients. Jusqu'à 15% de conversions en plus. Installation rapide et sans frais cachés.,153,913,,0,Le paiement en plusieurs fois flexible et garanti,49,Une solution de confiance pour les commerçants,46,Un levier de performance incontournable,39,,,,https://almapay.com/fr-FR,,,,,,318141,73717,73717,28.240,,1805,273,6.612,75.685,Fairly Easy,4.101,1,0,49,1288,378,0,63.640,79,46,0,11,9,0,,,,,11d7cb75fb5495f94679963f49836d8f,0.075,,,,,fr-FR,1.1,,,,,,,,,,,,,,,,,,,,,,,,,,,,,,,,,,,,,,,,,,,,,,,,,,,,,,,,,,,,,,,,,,,,,,,,,,,,,,,,,,,,,,,,,,,,,,,,,https://almapay.com/fr-FR,2026-04-27 15:44:04
2026-04-27,https://almapay.com/solutions/stores,text/html; charset=utf-8,200,OK,Indexable,,Increase your in-store sales | Alma,35,306,Let your customers pay at their own pace: in instalments or later. Improve their payment experience and boost your turnover by 20%.,131,816,,0,Make more in-store sales.,25,Solutions designed for in-store needs,37,The in-store payment experience,31,,,,https://almapay.com/solutions/stores,,,,,,227590,51492,51492,19.726,,894,144,6.208,59.060,Fairly Hard,2.954,1,1,14,64,50,0,8.420,60,28,0,12,11,0,,,,,c963dde9911eb282a3711645a54aad75,0.052,,,,,en-FR,1.1,,,,,,,,,,,,,,,,,,,,,,,,,,,,,,,,,,,,,,,,,,,,,,,,,,,,,,,,,,,,,,,,,,,,,,,,,,,,,,,,,,,,,,,,,,,,,,,,,https://almapay.com/solutions/stores,2026-04-27 15:44:04
2026-04-27,https://almapay.com/consumers,text/html; charset=utf-8,200,OK,Indexable,,"Libérez vos achats, payez en plusieurs fois | Alma",50,441,Payez avec Alma dans plus de 21 000 enseignes et ajustez vos échéances gratuitement si besoin.,94,599,,0,"Unlock your purchases, pay in instalments.",42,Simple and immediate payment in instalments.,44,Postpone your Installments for free,35,,,,https://almapay.com/consumers,,,,,,219130,42933,42933,16.447,,294,50,5.880,69.938,Normal,0.945,1,0,30,150,53,0,8.920,33,12,0,25,24,0,,,,,ac6c16f66c3cc329fb288edc3eccd8d,0.098,,,,,en-FR,1.1,,,,,,,,,,,,,,,,,,,,,,,,,,,,,,,,,,,,,,,,,,,,,,,,,,,,,,,,,,,,,,,,,,,,,,,,,,,,,,,,,,,,,,,,,,,,,,,,,https://almapay.com/consumers,2026-04-27 15:44:05
2026-04-27,https://almapay.com/legal/privacy-policy,text/html; charset=utf-8,200,OK,Indexable,,Privacy and Data Management Policy | Alma,41,394,Let your customers pay at their own pace: in instalments or later. Improve their payment experience and boost your turnover by 20%.,131,816,,0,Privacy and Data Management Policy,34,,0,,0,,,,https://almapay.com/legal/privacy-policy,,,,,,120785,30680,30680,11.753,,35,7,5.000,66.400,Normal,1.094,1,1,5,22,12,0,2.020,49,27,0,10,9,0,,,,,7dc6bd23e0c7470abba244bda5d8be51,0.054,,,,,en-FR,1.1,,,,,,,,,,,,,,,,,,,,,,,,,,,,,,,,,,,,,,,,,,,,,,,,,,,,,,,,,,,,,,,,,,,,,,,,,,,,,,,,,,,,,,,,,,,,,,,,,https://almapay.com/legal/privacy-policy,2026-04-27 15:44:05
2026-04-27,https://almapay.com/solutions/international,text/html; charset=utf-8,200,OK,Indexable,,Développez vos ventes à l'international avec Alma | Alma,56,508,Proposez des facilités de paiement à vos clients en Europe. Des moyens de paiement adaptés aux attentes locales. Des experts pour vous accompagner.,147,937,,0,Develop your international sales,32,Support your expansion in Europe,32,Adapt to the demands of local commerce,38,,,,https://almapay.com/solutions/international,,,,,,223951,47056,47056,18.026,,712,138,5.159,74.223,Fairly Easy,2.430,1,1,13,49,43,0,7.240,56,26,0,10,9,0,,,,,54b974a8c907b9eb5a63c880f2b3f3ad,0.051,,,,,en-FR,1.1,,,,,,,,,,,,,,,,,,,,,,,,,,,,,,,,,,,,,,,,,,,,,,,,,,,,,,,,,,,,,,,,,,,,,,,,,,,,,,,,,,,,,,,,,,,,,,,,,https://almapay.com/solutions/international,2026-04-27 15:44:05
2026-04-27,https://almapay.com/contact-us,text/html; charset=utf-8,200,OK,Indexable,,Contact us | Alma,17,158,Let your customers pay at their own pace: in instalments or later. Improve their payment experience and boost your turnover by 20%.,131,816,,0,Contact us,10,"Increase your sales, just like the 21 000 brands already using Almac",68,,0,,,,https://almapay.com/contact-us,,,,,,130059,32824,32824,12.574,,90,20,4.500,80.068,Easy,1.272,1,0,16,77,51,0,8.590,50,26,0,10,9,0,,,,,df786f9c8690887fff1b79cb51c95ac8,0.053,,,,,en-FR,1.1,,,,,,,,,,,,,,,,,,,,,,,,,,,,,,,,,,,,,,,,,,,,,,,,,,,,,,,,,,,,,,,,,,,,,,,,,,,,,,,,,,,,,,,,,,,,,,,,,https://almapay.com/contact-us,2026-04-27 15:44:05
2026-04-27,https://almapay.com/solutions/online,text/html; charset=utf-8,200,OK,Indexable,,Make more sales online | Alma,29,274,Let your customers pay at their own pace: in instalments or later. Improve their payment experience and boost your turnover by 20%.,131,816,,0,Make more sales online.,23,A fluid experience for e-commerce shops,39,The 100% online payment experience,34,,,,https://almapay.com/solutions/online,,,,,,253354,56984,56984,21.829,,1019,167,6.102,65.232,Normal,2.920,1,1,16,108,51,0,8.590,60,26,0,10,9,0,,,,,5b12664f65debebc6bf8905064504ee8,0.056,,,,,en-FR,1.1,,,,,,,,,,,,,,,,,,,,,,,,,,,,,,,,,,,,,,,,,,,,,,,,,,,,,,,,,,,,,,,,,,,,,,,,,,,,,,,,,,,,,,,,,,,,,,,,,https://almapay.com/solutions/online,2026-04-27 15:44:06
2026-04-27,https://almapay.com/es-ES,text/html; charset=utf-8,200,OK,Indexable,,Pago aplazado. Simple. Garantizado. | Alma,42,390,Deje que sus clientes paguen a su propio ritmo: a plazos o más tarde. Mejore su experiencia de pago y aumente su facturación en un 15%.,135,844,,0,Haz crecer tu negocio con pagos flexibles,41,Un motor clave de rendimiento,29,La herramienta fiable para impulsar tu negocio,46,,,,https://almapay.com/es-ES,,,,,,219653,52060,52060,19.943,,692,115,6.017,43.631,Hard,2.333,1,0,49,994,445,0,74.920,48,21,0,10,8,0,,,,,ed4ed8d852f4b88b5acf97d5d19c9388,0.047,,,,,es-ES,1.1,,,,,,,,,,,,,,,,,,,,,,,,,,,,,,,,,,,,,,,,,,,,,,,,,,,,,,,,,,,,,,,,,,,,,,,,,,,,,,,,,,,,,,,,,,,,,,,,,https://almapay.com/es-ES,2026-04-27 15:44:06
