2026-04-27,https://almapay.com/fr-FR/blog/meilleur-logiciel-de-caisse,text/html; charset=utf-8,200,OK,Indexable,,Top 9 des meilleurs logiciels de caisses certifiés en 2024,58,506,Un logiciel de caisse est requis pour faire du commerce en point de vente. Lequel choisir et quoi comparer ? On vous explique pour faire le meilleur choix.,155,928,,0,Les 9 meilleurs logiciels de caisse certifiés en 2026,53,Qu’est-ce qu’un logiciel de caisse ?,36,Quels sont les critères pour choisir un logiciel de caisse ?,60,,,,https://almapay.com/fr-FR/blog/meilleur-logiciel-de-caisse,,,,,,241173,59191,59191,22.675,,1848,266,6.947,65.421,Normal,5.820,4,2,1,7,3,0,0.510,79,50,0,9,8,0,,,,,92177ebe5a7457be039e54ae11b271e0,0.434,,,,,fr-FR,1.1,,,,,,,,,,,,,,,,,,,,,,,,,,,,,,,,,,,,,,,,,,,,,,,,,,,,,,,,,,,,,,,,,,,,,,,,,,,,,,,,,,,,,,,,,,,,,,,,,https://almapay.com/fr-FR/blog/meilleur-logiciel-de-caisse,2026-04-27 15:45:15
2026-04-27,https://almapay.com/es-ES/blog/como-aumentar-la-tasa-de-conversion-y-la-cesta-media-comercio,text/html; charset=utf-8,200,OK,Indexable,,¿Cómo puedes aumentar la tasa de conversión y la cesta media en el checkout?,76,711,"El mayor reto de los comercios, el funnel de ventas. ¿Cómo podemos mejorarlo?¿Cómo podemos aumentar las ventas?",111,732,,0,¿Cómo puedes aumentar la tasa de conversión y la cesta media en el checkout?,76,,0,,0,,,,https://almapay.com/es-ES/blog/como-aumentar-la-tasa-de-conversion-y-la-cesta-media-comercio,,,,,,166366,47562,47562,18.220,,1200,164,7.317,41.277,Hard,5.048,4,2,1,3,2,0,0.340,45,24,0,10,8,0,,,,,10dea3719ac2cec49c8bd562677732d0,0.369,,,,,es-ES,1.1,,,,,,,,,,,,,,,,,,,,,,,,,,,,,,,,,,,,,,,,,,,,,,,,,,,,,,,,,,,,,,,,,,,,,,,,,,,,,,,,,,,,,,,,,,,,,,,,,https://almapay.com/es-ES/blog/como-aumentar-la-tasa-de-conversion-y-la-cesta-media-comercio,2026-04-27 15:45:15
2026-04-27,https://almapay.com/fr-FR/blog/digitalisation-des-points-de-vente,text/html; charset=utf-8,200,OK,Indexable,,Digitalisation des points de vente : 7 exemples et conseils,59,515,Digitaliser un point de vente permet d’améliorer l’expérience de vos clients et collaborateurs. Découvrez les avantages et outils à mettre en place !,149,887,,0,La digitalisation des points de vente : réussir avec ces 7 exemples,67,Qu’est-ce que la digitalisation du point de vente ?,51,Pourquoi digitaliser un point de vente : les avantages pour votre commerce,74,,,,https://almapay.com/fr-FR/blog/digitalisation-des-points-de-vente,,,,,,276548,70104,70104,26.856,,3098,437,7.089,72.985,Fairly Easy,7.612,4,2,1,20,13,0,2.190,82,54,0,15,14,0,,,,,58919af925fc9fd9fb8d2041a5f70264,0.473,,,,,fr-FR,1.1,,,,,,,,,,,,,,,,,,,,,,,,,,,,,,,,,,,,,,,,,,,,,,,,,,,,,,,,,,,,,,,,,,,,,,,,,,,,,,,,,,,,,,,,,,,,,,,,,https://almapay.com/fr-FR/blog/digitalisation-des-points-de-vente,2026-04-27 15:45:15
2026-04-27,https://almapay.com/fr-FR/blog/comment-un-petit-commercant-choisit-ses-reseaux-sociaux,text/html; charset=utf-8,200,OK,Indexable,,Comment choisir ses réseaux sociaux en tant que petit commerçant ?,66,623,"La France compte plus de 50 millions d’utilisateurs des réseaux sociaux. En moyenne, les Français passent 1 heure 48 par jour sur les réseaux. Il y a de fortes chances que vos (futurs) clients s’y tro...",203,1215,,0,Comment choisir ses réseaux sociaux en tant que petit commerçant ?,66,#1. Définissez vos objectifs,28,#2. Connaissez votre audience cible,35,,,,https://almapay.com/fr-FR/blog/comment-un-petit-commercant-choisit-ses-reseaux-sociaux,,,,,,254632,63324,63324,24.258,,1514,240,6.308,71.912,Fairly Easy,4.491,4,2,1,8,2,0,0.340,80,50,0,15,13,0,,,,,a4cdb93c9254a5f104b16a795b0609d7,0.419,,,,,fr-FR,1.1,,,,,,,,,,,,,,,,,,,,,,,,,,,,,,,,,,,,,,,,,,,,,,,,,,,,,,,,,,,,,,,,,,,,,,,,,,,,,,,,,,,,,,,,,,,,,,,,,https://almapay.com/fr-FR/blog/comment-un-petit-commercant-choisit-ses-reseaux-sociaux,2026-04-27 15:45:16
2026-04-27,https://almapay.com/fr-FR/blog/cross-merchandising,text/html; charset=utf-8,200,OK,Indexable,,"Cross-merchandising : définition, exemples et conseils",54,485,Le cross merchandising consiste à exposer des produits complémentaires pour favoriser les ventes croisées. Comment le faire ? Découvrez le guide complet.,153,960,,0,"Cross-merchandising : définition, exemples et conseils",54,Qu’est-ce que le cross merchandising ?,38,En quoi le cross merchandising influence le comportement d’achat ?,66,,,,https://almapay.com/fr-FR/blog/cross-merchandising,,,,,,241367,59778,59778,22.900,,1759,254,6.925,66.774,Normal,5.534,4,2,1,8,2,0,0.340,86,54,0,9,8,0,,,,,d6b7c71a621b21a4084bb46001f85461,0.358,,,,,fr-FR,1.1,,,,,,,,,,,,,,,,,,,,,,,,,,,,,,,,,,,,,,,,,,,,,,,,,,,,,,,,,,,,,,,,,,,,,,,,,,,,,,,,,,,,,,,,,,,,,,,,,https://almapay.com/fr-FR/blog/cross-merchandising,2026-04-27 15:45:16
2026-04-27,https://almapay.com/fr-FR/blog/pourquoi-faisons-nous-de-la-pub-chez-alma,text/html; charset=utf-8,200,OK,Indexable,,Pourquoi faisons-nous de la pub chez Alma ? | Alma,50,460,Comment nous positionner auprès des marchands et de leurs clients ? Comment devenir l’acteur préféré du Buy Now Pay Later ?,123,791,,0,Pourquoi faisons-nous de la pub chez Alma ?,43,"« Intel », ça vous dit bien quelque chose non ?",47,Faire savoir plus que faire connaître.,38,,,,https://almapay.com/fr-FR/blog/pourquoi-faisons-nous-de-la-pub-chez-alma,,,,,,222163,55665,55665,21.324,,1331,184,7.234,79.299,Fairly Easy,4.518,4,2,1,6,3,0,0.510,76,51,0,9,8,0,,,,,922a61e98bb5613509e05ae11a638d70,0.429,,,,,fr-FR,1.1,,,,,,,,,,,,,,,,,,,,,,,,,,,,,,,,,,,,,,,,,,,,,,,,,,,,,,,,,,,,,,,,,,,,,,,,,,,,,,,,,,,,,,,,,,,,,,,,,https://almapay.com/fr-FR/blog/pourquoi-faisons-nous-de-la-pub-chez-alma,2026-04-27 15:45:16
2026-04-27,https://almapay.com/fr-FR/blog/choisir-meilleur-cms,text/html; charset=utf-8,200,OK,Indexable,,Meilleur CMS en 2024 : que choisir pour un site Internet ?,58,506,Un CMS (Content Management System) vous aide à gérer et déployer en ligne le contenu d’un site web. Quel est le meilleur choix pour vous ? On vous explique.,156,971,,0,Comparatif des meilleurs CMS du marché en 2025,46,Qu’est-ce qu’un CMS ou système de gestion de contenu ?,54,Quelles sont les fonctionnalités attendues d’un excellent CMS ?,63,,,,https://almapay.com/fr-FR/blog/choisir-meilleur-cms,,,,,,256340,63745,63745,24.419,,2038,287,7.101,71.441,Fairly Easy,5.844,4,2,1,11,5,0,0.840,79,49,0,9,8,0,,,,,af2fd9e4ac31093bbfc1cfbb2f7d60a2,0.436,,,,,fr-FR,1.1,,,,,,,,,,,,,,,,,,,,,,,,,,,,,,,,,,,,,,,,,,,,,,,,,,,,,,,,,,,,,,,,,,,,,,,,,,,,,,,,,,,,,,,,,,,,,,,,,https://almapay.com/fr-FR/blog/choisir-meilleur-cms,2026-04-27 15:45:16
2026-04-27,https://almapay.com/fr-FR/blog/coronavirus-alma-s-engage-pour-les-commercants-et-leurs-clients,text/html; charset=utf-8,200,OK,Indexable,,Covid : Alma s’engage pour les commerçants et leurs clients,59,538,"Dans un contexte où la machine économique tourne au ralenti, il est crucial de proposer un maximum de flexibilité aux consommateurs.",132,830,,0,Coronavirus : Alma s’engage pour les commerçants et leurs clients,65,,0,,0,,,,https://almapay.com/fr-FR/blog/coronavirus-alma-s-engage-pour-les-commercants-et-leurs-clients,,,,,,207173,47482,47482,18.189,,479,76,6.303,73.803,Fairly Easy,2.391,4,2,1,4,3,0,0.510,74,51,0,10,9,0,,,,,4a4e28277b75b8da28b98638a1793bdd,0.389,,,,,fr-FR,1.1,,,,,,,,,,,,,,,,,,,,,,,,,,,,,,,,,,,,,,,,,,,,,,,,,,,,,,,,,,,,,,,,,,,,,,,,,,,,,,,,,,,,,,,,,,,,,,,,,https://almapay.com/fr-FR/blog/coronavirus-alma-s-engage-pour-les-commercants-et-leurs-clients,2026-04-27 15:45:16
2026-04-27,https://almapay.com/fr-FR/blog/cross-selling,text/html; charset=utf-8,200,OK,Indexable,,"Cross-selling : définition, avantages pour e-commerce | Alma",60,541,Le cross-selling consiste à augmenter le panier d’un client grâce à la vente additionnelle. Exemple: acheter un vélo ET une assurance. On vous explique.,152,923,,0,"Cross-selling : définition, avantages et mise en place e-commerce",65,Qu’est-ce que le cross-selling ?,32,Quels sont les avantages du cross sell ?,40,,,,https://almapay.com/fr-FR/blog/cross-selling,,,,,,241618,58126,58126,22.267,,1585,224,7.076,64.346,Normal,5.142,4,2,1,31,23,0,3.870,83,54,0,9,8,0,,,,,c70389bb049263c14ad638978c55f465,0.427,,,,,fr-FR,1.1,,,,,,,,,,,,,,,,,,,,,,,,,,,,,,,,,,,,,,,,,,,,,,,,,,,,,,,,,,,,,,,,,,,,,,,,,,,,,,,,,,,,,,,,,,,,,,,,,https://almapay.com/fr-FR/blog/cross-selling,2026-04-27 15:45:17
2026-04-27,https://almapay.com/fr-FR/blog/comment-ameliorer-experience-client,text/html; charset=utf-8,200,OK,Indexable,,Comment améliorer l’expérience client : 9 actions business,58,526,L’expérience client est clé pour booster vos ventes et favoriser la fidélité. Quelles actions mettre en place pour l’améliorer ? On vous explique.,146,858,,0,Comment améliorer l’expérience client : 9 actions indispensables,64,En quoi consiste l’expérience client ?,38,1/ Bien définir votre stratégie et votre vision de marque,57,,,,https://almapay.com/fr-FR/blog/comment-ameliorer-experience-client,,,,,,262736,65115,65115,24.944,,2465,342,7.208,71.229,Fairly Easy,6.787,4,2,1,30,19,0,3.200,88,55,0,11,10,0,,,,,ef007e8eb2d376b3e516ab89a1f2b146,0.380,,,,,fr-FR,1.1,,,,,,,,,,,,,,,,,,,,,,,,,,,,,,,,,,,,,,,,,,,,,,,,,,,,,,,,,,,,,,,,,,,,,,,,,,,,,,,,,,,,,,,,,,,,,,,,,https://almapay.com/fr-FR/blog/comment-ameliorer-experience-client,2026-04-27 15:45:17
2026-04-27,https://almapay.com/fr-FR/blog/objections-de-ventes-magasin,text/html; charset=utf-8,200,OK,Indexable,,10 conseils pour contrer les objections de vente en magasin,59,533,"“C’est trop cher, je n’ai pas le budget, je repasse plus tard”. Une objection ne signifie pas la fin d’une vente. Comment y répondre ? On vous explique.",152,901,,0,10 exemples d’objections de vente en magasin et comment les contrer !,69,Qu’est-ce qu’une objection de vente courante ?,46,#1 - “Je suis juste venu(e) jeter un coup d’œil”,48,,,,https://almapay.com/fr-FR/blog/objections-de-ventes-magasin,,,,,,244984,61798,61798,23.674,,1951,280,6.968,75.876,Fairly Easy,5.739,4,2,1,18,6,0,1.010,88,52,0,9,8,0,,,,,32a665f35e82c33cd6538b1a9f6e82f6,0.048,,,,,fr-FR,1.1,,,,,,,,,,,,,,,,,,,,,,,,,,,,,,,,,,,,,,,,,,,,,,,,,,,,,,,,,,,,,,,,,,,,,,,,,,,,,,,,,,,,,,,,,,,,,,,,,https://almapay.com/fr-FR/blog/objections-de-ventes-magasin,2026-04-27 15:45:17
2026-04-27,https://almapay.com/es-ES/blog/impress-aumenta-su-tasa-de-conversion-de-ventas-con-alma,text/html; charset=utf-8,200,OK,Indexable,,Impress aumenta su tasa de conversión de ventas con Alma,56,537,"Hablamos con Simona Magliano, Chief-of-Staff de Impress para ver cuál ha sido el efecto de Alma en Impress.",107,676,,0,Impress aumenta su tasa de conversión de ventas con Alma,56,¿Por qué el equipo de Impress decidió incorporar Alma?,54,¿Cuál ha sido el efecto de Alma en Impress?,43,,,,https://almapay.com/es-ES/blog/impress-aumenta-su-tasa-de-conversion-de-ventas-con-alma,,,,,,143152,39566,39566,15.157,,524,77,6.805,42.837,Hard,2.876,4,2,1,3,2,0,0.340,46,24,0,10,8,0,,,,,461ca60ab80da811a752fea94311eefd,0.412,,,,,es-ES,1.1,,,,,,,,,,,,,,,,,,,,,,,,,,,,,,,,,,,,,,,,,,,,,,,,,,,,,,,,,,,,,,,,,,,,,,,,,,,,,,,,,,,,,,,,,,,,,,,,,https://almapay.com/es-ES/blog/impress-aumenta-su-tasa-de-conversion-de-ventas-con-alma,2026-04-27 15:45:17
2026-04-27,https://almapay.com/fr-FR/blog/up-selling,text/html; charset=utf-8,200,OK,Indexable,,Up-selling : définition et stratégie pour les commerçants,57,500,L’up-selling pousse vos clients à monter en gamme lors d’un achat. Cela se traduit par un meilleur panier moyen pour votre activité. On vous explique.,150,916,,0,"Up-selling : définition, exemples et stratégie de mise en place",63,Qu’est-ce que l’up-selling ?,28,Quels sont les avantages de l’up-selling ?,42,,,,https://almapay.com/fr-FR/blog/up-selling,,,,,,239450,57959,57959,22.203,,1688,229,7.371,69.847,Normal,5.332,4,2,1,22,15,0,2.530,84,53,0,9,8,0,,,,,e3b6fc468f4690c34d02b1f875cbad5a,0.471,,,,,fr-FR,1.1,,,,,,,,,,,,,,,,,,,,,,,,,,,,,,,,,,,,,,,,,,,,,,,,,,,,,,,,,,,,,,,,,,,,,,,,,,,,,,,,,,,,,,,,,,,,,,,,,https://almapay.com/fr-FR/blog/up-selling,2026-04-27 15:45:17
2026-04-27,https://almapay.com/fr-FR/blog/taux-conversion-definition-calcul,text/html; charset=utf-8,200,OK,Indexable,,Taux de conversion : comment le calculer et l’optimiser ?,57,506,Le taux de conversion définit le pourcentage de visiteurs qui deviennent prospects ou clients. Comment le calculer ? Comment l’optimiser ? On vous explique.,156,960,,0,Taux de conversion : mieux le comprendre pour optimiser ses ventes,66,Qu’est-ce que le taux de conversion ?,37,Comment calculer facilement le taux de conversion ?,51,,,,https://almapay.com/fr-FR/blog/taux-conversion-definition-calcul,,,,,,234497,57258,57258,21.934,,1538,213,7.221,76.126,Fairly Easy,4.914,4,2,1,41,31,0,5.220,79,52,0,9,8,0,,,,,c340e8165af757d03e719891aa7e858a,0.316,,,,,fr-FR,1.1,,,,,,,,,,,,,,,,,,,,,,,,,,,,,,,,,,,,,,,,,,,,,,,,,,,,,,,,,,,,,,,,,,,,,,,,,,,,,,,,,,,,,,,,,,,,,,,,,https://almapay.com/fr-FR/blog/taux-conversion-definition-calcul,2026-04-27 15:45:18
2026-04-27,https://almapay.com/it-IT/blog/come-aumentare-valore-medio-carrello,text/html; charset=utf-8,200,OK,Indexable,,"Carrello medio: definizione, calcolo e come migliorarlo",55,483,"Il carrello medio è un KPI fondamentale: scopri cos’è, come si calcola e perché è importante per migliorare la redditività del tuo business.",140,831,,0,11 metodi per aumentare il carrello medio dei tuoi clienti,58,Cos'è il carrello medio?,24,#1 - Rivedere la strategia di pricing,37,,,,https://almapay.com/it-IT/blog/come-aumentare-valore-medio-carrello,,,,,,188007,50248,50248,19.249,,1724,242,7.124,28.245,Very Hard,6.532,4,2,1,17,3,0,0.510,65,29,0,10,8,0,,,,,393797339915eefd608f78c41ae59835,0.401,,,,,it-IT,1.1,,,,,,,,,,,,,,,,,,,,,,,,,,,,,,,,,,,,,,,,,,,,,,,,,,,,,,,,,,,,,,,,,,,,,,,,,,,,,,,,,,,,,,,,,,,,,,,,,https://almapay.com/it-IT/blog/come-aumentare-valore-medio-carrello,2026-04-27 15:45:18
2026-04-27,https://almapay.com/fr-FR/blog/ventes-privees,text/html; charset=utf-8,200,OK,Indexable,,12 conseils pour réussir et organiser une vente privée,54,476,Les ventes privées boostent les ventes auprès d’une cible fidélisée ou que vous souhaitez fidélisée. Comment réussir ce format ? Découvrez les conseils.,152,929,,0,Organiser et réussir des ventes privées : 12 conseils à suivre,62,Qu’est-ce qu’une vente privée ?,31,Ventes privées : pour les clients VIP ou une large clientèle ?,62,,,,https://almapay.com/fr-FR/blog/ventes-privees,,,,,,272236,68742,68742,26.334,,3050,416,7.332,71.356,Fairly Easy,7.814,4,2,1,8,4,0,0.670,80,54,0,9,8,0,,,,,f5e7425a400950994e9d383197bc05e7,0.387,,,,,fr-FR,1.1,,,,,,,,,,,,,,,,,,,,,,,,,,,,,,,,,,,,,,,,,,,,,,,,,,,,,,,,,,,,,,,,,,,,,,,,,,,,,,,,,,,,,,,,,,,,,,,,,https://almapay.com/fr-FR/blog/ventes-privees,2026-04-27 15:45:18
2026-04-27,https://almapay.com/fr-FR/blog/comment-obtenir-plus-d-avis-google-pour-votre-commerce,text/html; charset=utf-8,200,OK,Indexable,,Comment obtenir plus d’avis Google pour votre commerce ?,56,534,Les avis clients jouent un rôle clé dans les décisions d’achat des consommateurs. Vous pouvez (et vous devriez) mettre en place des actions pour obtenir plus d’avis Google.,172,1057,,0,Comment obtenir plus d’avis Google pour votre commerce ?,56,L’impact des avis Google dans les décisions d’achat,51,Pourquoi vous devriez recueillir plus d’avis en ligne,53,,,,https://almapay.com/fr-FR/blog/comment-obtenir-plus-d-avis-google-pour-votre-commerce,,,,,,238824,60343,60343,23.116,,1298,187,6.941,75.432,Fairly Easy,4.176,4,2,1,7,3,0,0.510,77,50,0,13,12,0,,,,,c2e4d764d32fb5197876e7e04e3ac50c,0.384,,,,,fr-FR,1.1,,,,,,,,,,,,,,,,,,,,,,,,,,,,,,,,,,,,,,,,,,,,,,,,,,,,,,,,,,,,,,,,,,,,,,,,,,,,,,,,,,,,,,,,,,,,,,,,,https://almapay.com/fr-FR/blog/comment-obtenir-plus-d-avis-google-pour-votre-commerce,2026-04-27 15:45:18
2026-04-27,https://almapay.com/fr-FR/blog/optimisation-taux-de-conversion,text/html; charset=utf-8,200,OK,Indexable,,10 actions pour augmenter votre taux de conversion | Alma,57,526,Le taux de conversion vous permet de mesurer le nombre de visiteurs qui convertissent sur votre site e-commerce. Découvrez nos conseils pour l’augmenter !,154,962,,0,10 actions pour augmenter votre taux de conversion,50,En quoi consiste l'optimisation du taux de conversion ?,55,Comment mesurer l’optimisation du taux de conversion ?,54,,,,https://almapay.com/fr-FR/blog/optimisation-taux-de-conversion,,,,,,254912,63769,63769,24.429,,2300,306,7.516,69.290,Normal,6.464,4,2,1,24,9,0,1.520,97,58,0,11,10,0,,,,,e680e0a9cbdec7847d38c49f8972c126,0.388,,,,,fr-FR,1.1,,,,,,,,,,,,,,,,,,,,,,,,,,,,,,,,,,,,,,,,,,,,,,,,,,,,,,,,,,,,,,,,,,,,,,,,,,,,,,,,,,,,,,,,,,,,,,,,,https://almapay.com/fr-FR/blog/optimisation-taux-de-conversion,2026-04-27 15:45:18
2026-04-27,https://almapay.com/it-IT/blog/pagamento-differito,text/html; charset=utf-8,200,OK,Indexable,,"Pagamento differito: cos’è, come funziona e i suoi vantaggi",59,527,"Il pagamento differito ti permette di saldare un ordine dopo 15 o 30 giorni, senza interessi. Scopri tutti i vantaggi di questa modalità.",137,809,,0,Tutto quello che c'è da sapere sul pagamento differito,54,Cos'è il pagamento differito?,29,Come funziona il pagamento differito?,37,,,,https://almapay.com/it-IT/blog/pagamento-differito,,,,,,173979,46070,46070,17.649,,1196,168,7.119,21.779,Very Hard,5.040,4,2,1,11,3,0,0.510,59,29,0,10,8,0,,,,,7ab4f1eb211b36e31ceadb5da9d2252e,0.390,,,,,it-IT,1.1,,,,,,,,,,,,,,,,,,,,,,,,,,,,,,,,,,,,,,,,,,,,,,,,,,,,,,,,,,,,,,,,,,,,,,,,,,,,,,,,,,,,,,,,,,,,,,,,,https://almapay.com/it-IT/blog/pagamento-differito,2026-04-27 15:45:19
2026-04-27,https://almapay.com/fr-FR/blog/assurer-croissance-ecommerce,text/html; charset=utf-8,200,OK,Indexable,,Assurer la croissance d’un e-commerce : 8 conseils à suivre,59,530,Votre e-commerce est rentable. Mais quelle est votre stratégie pour accompagner sa croissance ? Découvrez les KPIs à contrôler et nos conseils.,143,887,,0,Assurer la croissance d’un e-commerce : 8 conseils à suivre,59,Pourquoi maintenir la croissance d’une activité e-commerce ?,60,1/ Mesurer constamment vos indicateurs de performance (KPIs),60,,,,https://almapay.com/fr-FR/blog/assurer-croissance-ecommerce,,,,,,242169,60915,60915,23.335,,1891,256,7.387,63.781,Normal,5.949,4,2,1,16,5,0,0.840,91,57,0,10,9,0,,,,,f625ba67cddfcc781eefefd239dbaa30,0.427,,,,,fr-FR,1.1,,,,,,,,,,,,,,,,,,,,,,,,,,,,,,,,,,,,,,,,,,,,,,,,,,,,,,,,,,,,,,,,,,,,,,,,,,,,,,,,,,,,,,,,,,,,,,,,,https://almapay.com/fr-FR/blog/assurer-croissance-ecommerce,2026-04-27 15:45:19
2026-04-27,https://almapay.com/fr-FR/blog/6-conseils-pour-optimiser-le-parcours-d-achat-en-magasin,text/html; charset=utf-8,200,OK,Indexable,,6 conseils pour optimiser le parcours d’achat en magasin,56,507,"Expérience sensorielle, conseil, instantanéité de l’achat, le magasin possède plusieurs atouts. 
Pour booster vos ventes et fidéliser vos clients, capitalisez sur les atouts du commerce physique. Fait...",203,1205,,0,6 conseils pour optimiser le parcours d’achat en magasin,56,"Le parcours d’achat en magasin : définition, impact et enjeux",61,#Conseil 1. Créez une vitrine attractive pour votre magasin,59,,,,https://almapay.com/fr-FR/blog/6-conseils-pour-optimiser-le-parcours-d-achat-en-magasin,,,,,,262966,65444,65444,25.070,,2104,308,6.831,71.755,Fairly Easy,5.834,4,2,1,15,7,0,1.180,81,50,0,15,13,0,,,,,25e77c1476fa031188a2c5749e059c83,0.359,,,,,fr-FR,1.1,,,,,,,,,,,,,,,,,,,,,,,,,,,,,,,,,,,,,,,,,,,,,,,,,,,,,,,,,,,,,,,,,,,,,,,,,,,,,,,,,,,,,,,,,,,,,,,,,https://almapay.com/fr-FR/blog/6-conseils-pour-optimiser-le-parcours-d-achat-en-magasin,2026-04-27 15:45:19
2026-04-27,https://almapay.com/fr-FR/blog/phygital,text/html; charset=utf-8,200,OK,Indexable,,"Phygital : définition, avantages et 8 exemples concrets",55,486,Découvrez des exemples de stratégies phygitales pour créer une vraie synergie entre marketing digital et physique et augmenter votre satisfaction client.,153,935,,0,"Phygital : définition, avantages et 8 exemples pour inspirer votre stratégie",76,Qu'est-ce que le phygital ?,27,Comment mettre en place une stratégie phygitale ?,49,,,,https://almapay.com/fr-FR/blog/phygital,,,,,,281943,69389,69389,26.582,,2966,408,7.270,68.734,Normal,7.368,4,2,1,18,12,0,2.020,85,56,0,13,12,0,,,,,4d9dc2890ad5477e855781c12359bdf5,0.506,,,,,fr-FR,1.1,,,,,,,,,,,,,,,,,,,,,,,,,,,,,,,,,,,,,,,,,,,,,,,,,,,,,,,,,,,,,,,,,,,,,,,,,,,,,,,,,,,,,,,,,,,,,,,,,https://almapay.com/fr-FR/blog/phygital,2026-04-27 15:45:19
2026-04-27,https://almapay.com/it-IT/blog/carrello-abbandonato,text/html; charset=utf-8,200,OK,Indexable,,Carrelli abbandonati: perché succede e come recuperarli,55,502,Il carrello abbandonato indica che l’utente non ha completato l’acquisto. Scopri perché succede e come recuperare le vendite perse.,131,805,,0,Carrelli abbandonati: 10 consigli per ridurli e riattivare i clienti,68,Che cos’è un abbandono del carrello?,36,Perché i clienti abbandonano un carrello e-commerce?,52,,,,https://almapay.com/it-IT/blog/carrello-abbandonato,,,,,,184151,49484,49484,18.956,,1515,226,6.704,23.572,Very Hard,6.016,4,2,1,10,3,0,0.510,59,29,0,10,8,0,,,,,7c83705f846747e3be844dfb9541796b,0.405,,,,,it-IT,1.1,,,,,,,,,,,,,,,,,,,,,,,,,,,,,,,,,,,,,,,,,,,,,,,,,,,,,,,,,,,,,,,,,,,,,,,,,,,,,,,,,,,,,,,,,,,,,,,,,https://almapay.com/it-IT/blog/carrello-abbandonato,2026-04-27 15:45:19
2026-04-27,https://almapay.com/pt-PT/legal/termos-e-condicoes,text/html; charset=utf-8,200,OK,Indexable,,Termos e Condições | Alma,25,245,Permita que seus clientes paguem em seu próprio ritmo: em parcelas ou mais tarde. Melhore sua experiência de pagamento e aumente seu faturamento em 20%.,152,990,,0,Termos e Condições,18,,0,,0,,,,https://almapay.com/pt-PT/legal/termos-e-condicoes,,,,,,112590,30092,30092,11.528,,33,7,4.714,48.232,Hard,0.921,4,2,1,20,10,0,1.680,38,20,0,10,9,0,,,,,4cfbde69995cdadedb189919de54c907,0.411,,,,,pt-PT,1.1,,,,,,,,,,,,,,,,,,,,,,,,,,,,,,,,,,,,,,,,,,,,,,,,,,,,,,,,,,,,,,,,,,,,,,,,,,,,,,,,,,,,,,,,,,,,,,,,,https://almapay.com/pt-PT/legal/termos-e-condicoes,2026-04-27 15:45:19
2026-04-27,https://almapay.com/fr-FR/blog/faire-fiche-produit,text/html; charset=utf-8,200,OK,Indexable,,Fiche produit : 10 conseils pour la rédiger (+ exemples),56,487,Une fiche produit (ou page produit) condense toutes les informations liées à un produit ou un service. Comment créer une fiche efficace ? On vous explique.,155,952,,0,Créer une fiche produit : 13 conseils avec exemples e-commerce,62,Qu’est-ce qu’une fiche produit ?,32,Comment rédiger et concevoir une fiche produit efficace ?,57,,,,https://almapay.com/fr-FR/blog/faire-fiche-produit,,,,,,288285,77683,77683,29.759,,3377,444,7.606,64.912,Normal,8.308,4,2,1,14,8,0,1.350,83,56,0,13,12,0,,,,,821911841a91af5e969a77572f179225,0.351,,,,,fr-FR,1.1,,,,,,,,,,,,,,,,,,,,,,,,,,,,,,,,,,,,,,,,,,,,,,,,,,,,,,,,,,,,,,,,,,,,,,,,,,,,,,,,,,,,,,,,,,,,,,,,,https://almapay.com/fr-FR/blog/faire-fiche-produit,2026-04-27 15:45:19
2026-04-27,https://almapay.com/fr-FR/blog/vente-additionnelle,text/html; charset=utf-8,200,OK,Indexable,,Comment faire de la vente additionnelle pour les commerçants,60,563,La vente additionnelle est un levier pour augmenter le chiffre d’affaires d’un commerce. Mais quelles techniques faut-il employer ? Découvrez-les.,146,886,,0,Comment faire de la vente additionnelle : exemples et conseils,62,Qu’est-ce qu’une vente additionnelle ?,38,Exemples : en quoi consiste une vente additionnelle ?,53,,,,https://almapay.com/fr-FR/blog/vente-additionnelle,,,,,,246399,60490,60490,23.173,,1702,245,6.947,72.387,Fairly Easy,5.128,4,2,1,8,4,0,0.670,85,55,0,9,8,0,,,,,227327677b15fb98a5cfe6cad151c464,0.375,,,,,fr-FR,1.1,,,,,,,,,,,,,,,,,,,,,,,,,,,,,,,,,,,,,,,,,,,,,,,,,,,,,,,,,,,,,,,,,,,,,,,,,,,,,,,,,,,,,,,,,,,,,,,,,https://almapay.com/fr-FR/blog/vente-additionnelle,2026-04-27 15:45:20
2026-04-27,https://almapay.com/it-IT/blog/come-offrire-pagamento-rateale,text/html; charset=utf-8,200,OK,Indexable,,Come offrire il pagamento a rate online e in negozio | Alma,59,525,Offrire il pagamento a rate aiuta ad aumentare le vendite online e in negozio. Scopri come attivarlo e migliorare l’esperienza cliente.,135,801,,0,Come offrire il pagamento a rate online e in negozio,52,Che cos’è il pagamento in più rate?,35,Come proporre il pagamento in più rate online,45,,,,https://almapay.com/it-IT/blog/come-offrire-pagamento-rateale,,,,,,173870,46169,46169,17.686,,1087,183,5.940,38.144,Hard,4.543,4,2,1,11,4,0,0.670,58,29,0,10,8,0,,,,,ea8443a7d424c7b953b03d4f40441ea1,0.372,,,,,it-IT,1.1,,,,,,,,,,,,,,,,,,,,,,,,,,,,,,,,,,,,,,,,,,,,,,,,,,,,,,,,,,,,,,,,,,,,,,,,,,,,,,,,,,,,,,,,,,,,,,,,,https://almapay.com/it-IT/blog/come-offrire-pagamento-rateale,2026-04-27 15:45:20
2026-04-27,https://almapay.com/fr-FR/blog/augmentez-vos-ventes-avec-les-emails-automatiques-5-actions-a-lancer-des-maintena,text/html; charset=utf-8,200,OK,Indexable,,5 actions pour Augmenter vos ventes avec les emails | Alma,58,537,Voici quelques-uns des bénéfices qui s’offrent à vous si vous mettez en place le marketing automation.,102,630,,0,Augmentez vos ventes avec les emails automatiques – 5 actions à lancer dès maintenant,85,Quelques règles à respecter,27,Action n°1 : profitez de votre premier contact,46,,,,https://almapay.com/fr-FR/blog/augmentez-vos-ventes-avec-les-emails-automatiques-5-actions-a-lancer-des-maintena,,,,,,230974,59175,59175,22.669,,1877,261,7.192,75.453,Fairly Easy,5.842,4,2,1,11,3,0,0.510,81,51,0,9,8,0,,,,,947f12949408e142f2dbcd0ac192da71,0.372,,,,,fr-FR,1.1,,,,,,,,,,,,,,,,,,,,,,,,,,,,,,,,,,,,,,,,,,,,,,,,,,,,,,,,,,,,,,,,,,,,,,,,,,,,,,,,,,,,,,,,,,,,,,,,,https://almapay.com/fr-FR/blog/augmentez-vos-ventes-avec-les-emails-automatiques-5-actions-a-lancer-des-maintena,2026-04-27 15:45:20
